platform,is_social,user_id,country,brand,product,timestamp,rating,likes,text
TikTok,True,user_91663,ES,Sony,WF-1000XM4,2025-07-24 14:50:32.196741,3.812,4.0,hace su trabajo con Sony WF-1000XM4 cumple su función. 🤔
TikTok,True,user_90651,US,Apple,MacBook Pro,2025-07-24 15:37:28.196741,3.812,11.0,nada extraordinario con Apple MacBook Pro sin más.
TikTok,True,user_89244,US,Apple,MacBook Pro,2025-07-24 15:37:47.196741,3.812,20.0,experiencia fantástica con Apple MacBook Pro.
TikTok,True,user_27627,AR,Samsung,Galaxy Tab,2025-07-24 16:31:50.196741,3.812,31.0,defectuoso desde el inicio con Samsung Galaxy Tab eviten comprarlo. 💔
Shopify,False,user_75401,CO,Samsung,Galaxy Tab,2025-07-24 16:53:56.196741,4.0,28.927142857142858,funciona de maravilla con Samsung Galaxy Tab vale la pena.  #samsung
Shopify,False,user_64827,DO,Adidas,Predator,2025-07-24 20:10:26.196741,2.0,28.927142857142858,producto estándar con Adidas Predator. 😐
Amazon,False,user_39116,AR,Samsung,QLED TV,2025-07-25 01:20:41.196741,5.0,28.927142857142858,muy recomendado con Samsung QLED TV increíble producto.
TikTok,True,user_15723,CO,Adidas,Ultraboost 22,2025-07-25 01:33:02.196741,3.812,0.0,decepcionante compra con Adidas Ultraboost 22 busquen alternativas. 😞
TikTok,True,user_44524,CO,Sony,Bravia TV,2025-07-25 01:53:58.196741,3.812,25.0,experiencia horrible con Sony Bravia TV no lo volvería a comprar. 👎
Amazon,False,user_20775,US,Sony,WF-1000XM4,2025-07-25 06:49:47.196741,4.0,28.927142857142858,defectuoso desde el inicio con Sony WF-1000XM4 no lo volvería a comprar. 👎
MercadoLibre,False,user_15965,DO,Adidas,Predator,2025-07-25 09:57:13.196741,4.0,28.927142857142858,experiencia fantástica con Adidas Predator me encantó. 🎉
Reddit,True,user_97410,PE,Sony,WF-1000XM4,2025-07-25 11:32:03.196741,3.812,50.0,lo mejor que he comprado con Sony WF-1000XM4 excelente compra. 😍 #recomendacion
TikTok,True,user_13830,ES,Apple,iPhone 15,2025-07-25 14:45:58.196741,3.812,0.0,duración pésima con Apple iPhone 15 pésima experiencia. 😡 #review
X/Twitter,True,user_83060,CO,Adidas,Superstar,2025-07-25 15:23:54.196741,3.812,22.0,no lo recomiendo con Adidas Superstar no lo volvería a comprar. 🤦‍♂️
Amazon,False,user_54223,CL,Adidas,Stan Smith,2025-07-25 15:52:37.196741,3.0,28.927142857142858,se dañó rápido con Adidas Stan Smith me arrepiento. 😡
MercadoLibre,False,user_80772,US,Sony,Bravia TV,2025-07-25 16:00:12.196741,5.0,28.927142857142858,soporte al cliente excelente con Sony Bravia TV excelente compra. 😍
Amazon,False,user_81582,CO,Nike,Dri-FIT,2025-07-25 20:39:41.196741,4.0,28.927142857142858,buena relación calidad precio con Nike Dri-FIT vale la pena. 🎉 #review
Reddit,True,user_90381,US,Samsung,Galaxy S24,2025-07-25 23:54:40.196741,3.812,17.0,cumple lo básico con Samsung Galaxy S24. 🆗
Amazon,False,user_73344,AR,Samsung,Galaxy Buds,2025-07-26 16:20:35.196741,3.0,28.927142857142858,demasiado caro para lo que ofrece con Samsung Galaxy Buds eviten comprarlo. 😞 #review
MercadoLibre,False,user_54341,MX,Adidas,Stan Smith,2025-07-26 19:12:25.196741,5.0,28.927142857142858,lo mejor que he comprado con Adidas Stan Smith vale la pena. 💯
X/Twitter,True,user_96374,PE,Samsung,Galaxy S24,2025-07-26 19:29:22.196741,3.812,52.0,soporte al cliente excelente con Samsung Galaxy S24 increíble producto. 👌
Shopify,False,user_96108,CL,Sony,WF-1000XM4,2025-07-26 19:35:39.196741,5.0,28.927142857142858,buena relación calidad precio con Sony WF-1000XM4 vale la pena. 🎉
Shopify,False,user_22499,DO,Sony,WF-1000XM4,2025-07-27 07:45:50.196741,5.0,28.927142857142858,impresionante tecnología con Sony WF-1000XM4 vale la pena.  #sony
MercadoLibre,False,user_92150,DO,Nike,Air Force 1,2025-07-27 08:42:43.196741,4.0,28.927142857142858,duración increíble con Nike Air Force 1 súper recomendado. 👌 #tech
Reddit,True,user_22793,CL,Adidas,Stan Smith,2025-07-27 09:29:21.196741,3.812,77.0,buena relación calidad precio con Adidas Stan Smith increíble producto.
MercadoLibre,False,user_81509,AR,Apple,Apple Watch,2025-07-27 11:07:45.196741,3.0,28.927142857142858,veremos con el tiempo con Apple Apple Watch veremos con el tiempo.
Instagram,True,user_65985,PE,Samsung,Galaxy S24,2025-07-27 11:32:12.196741,3.812,29.0,superó mis expectativas con Samsung Galaxy S24 súper recomendado. 😍
MercadoLibre,False,user_82790,US,Samsung,Galaxy Watch,2025-07-27 11:32:29.196741,4.0,28.927142857142858,funciona de maravilla con Samsung Galaxy Watch. ⭐
Shopify,False,user_98864,DO,Sony,WH-1000XM5,2025-07-27 16:44:45.196741,2.0,28.927142857142858,pérdida de dinero con Sony WH-1000XM5 eviten comprarlo.
X/Twitter,True,user_88893,MX,Nike,Air Jordan,2025-07-27 20:43:46.196741,3.812,9.0,demasiado caro para lo que ofrece con Nike Air Jordan pésima experiencia. 😤
Instagram,True,user_19521,CO,Samsung,Galaxy Buds,2025-07-27 23:33:37.196741,3.812,12.0,producto estándar con Samsung Galaxy Buds nada especial. 🆗 #review
MercadoLibre,False,user_44205,MX,Apple,MacBook Pro,2025-07-27 23:36:19.196741,5.0,28.927142857142858,experiencia fantástica con Apple MacBook Pro lo volvería a comprar.
Amazon,False,user_74283,US,Nike,Air Jordan,2025-07-28 02:31:08.196741,5.0,28.927142857142858,duración increíble con Nike Air Jordan excelente compra.
TikTok,True,user_18379,MX,Adidas,Predator,2025-07-28 03:48:51.196741,3.812,30.0,entrega tardía con Adidas Predator.  #compras
Instagram,True,user_83659,US,Nike,React Infinity,2025-07-28 07:56:27.196741,3.812,98.0,experiencia fantástica con Nike React Infinity vale la pena. 🔥
TikTok,True,user_64269,DO,Samsung,QLED TV,2025-07-28 08:05:06.196741,3.812,50.0,rendimiento excepcional con Samsung QLED TV súper recomendado.  #qledtv
Amazon,False,user_92355,CL,Apple,AirPods Pro,2025-07-28 09:21:15.196741,4.0,28.927142857142858,soporte al cliente excelente con Apple AirPods Pro. 🎉 #recomendacion
Amazon,False,user_31906,US,Samsung,Galaxy S24,2025-07-28 09:54:50.196741,2.0,28.927142857142858,mala inversión con Samsung Galaxy S24 pésima experiencia.  #tech
TikTok,True,user_69243,MX,Sony,Bravia TV,2025-07-28 10:17:47.196741,3.812,17.0,tal como se describe con Sony Bravia TV sin más.
Amazon,False,user_99688,CL,Samsung,Galaxy Buds,2025-07-28 11:31:29.196741,4.0,28.927142857142858,diseño premium con Samsung Galaxy Buds increíble producto. 🔥
MercadoLibre,False,user_85397,CO,Adidas,Predator,2025-07-28 14:57:38.196741,5.0,28.927142857142858,soporte al cliente excelente con Adidas Predator increíble producto. 👌
Instagram,True,user_55780,PE,Sony,WH-1000XM5,2025-07-28 17:13:08.196741,3.812,37.0,lo esperado con Sony WH-1000XM5 cumple su función. 🆗
MercadoLibre,False,user_48086,US,Samsung,QLED TV,2025-07-28 19:09:01.196741,1.0,28.927142857142858,decepcionante compra con Samsung QLED TV no lo volvería a comprar.
MercadoLibre,False,user_63096,CL,Nike,Dri-FIT,2025-07-28 20:14:07.196741,5.0,28.927142857142858,vale cada peso con Nike Dri-FIT me encantó.
Reddit,True,user_84897,ES,Nike,Dri-FIT,2025-07-28 23:13:51.196741,3.812,44.0,muy recomendado con Nike Dri-FIT súper recomendado.
TikTok,True,user_43352,DO,Sony,PlayStation 5,2025-07-29 01:22:19.196741,3.812,30.0,experiencia horrible con Sony PlayStation 5. 💔
Reddit,True,user_34837,CL,Nike,Dri-FIT,2025-07-29 12:56:58.196741,3.812,29.0,excelente calidad con Nike Dri-FIT lo volvería a comprar.
TikTok,True,user_61369,ES,Apple,iPhone 15,2025-07-29 13:27:38.196741,3.812,4.0,fallas frecuentes con Apple iPhone 15 busquen alternativas.
Instagram,True,user_39333,ES,Nike,Dri-FIT,2025-07-29 20:10:06.196741,3.812,6.0,experiencia horrible con Nike Dri-FIT pésima experiencia. 😞
X/Twitter,True,user_85396,AR,Apple,iPhone 15,2025-07-29 21:13:41.196741,3.812,27.0,rendimiento excepcional con Apple iPhone 15 me encantó. ✨ #compras
MercadoLibre,False,user_92511,CO,Apple,MacBook Pro,2025-07-29 22:37:43.196741,2.0,28.927142857142858,soporte al cliente terrible con Apple MacBook Pro no lo volvería a comprar. 💔
TikTok,True,user_34560,MX,Adidas,Predator,2025-07-30 00:05:42.196741,3.812,45.0,problemas constantes con Adidas Predator busquen alternativas. 😞
Shopify,False,user_83010,AR,Sony,PlayStation 5,2025-07-30 00:47:44.196741,2.0,28.927142857142858,mala inversión con Sony PlayStation 5 eviten comprarlo.
TikTok,True,user_57918,CL,Apple,iPhone 15,2025-07-30 01:24:01.196741,3.812,7.0,producto estándar con Apple iPhone 15 veremos con el tiempo.
MercadoLibre,False,user_21627,CO,Samsung,Galaxy Watch,2025-07-30 03:50:42.196741,5.0,28.927142857142858,muy recomendado con Samsung Galaxy Watch excelente compra. 👌
TikTok,True,user_35200,CO,Sony,WF-1000XM4,2025-07-30 05:33:01.196741,3.812,26.0,buena relación calidad precio con Sony WF-1000XM4 me encantó. 💯
X/Twitter,True,user_51193,MX,Samsung,Galaxy Tab,2025-07-30 08:24:02.196741,3.812,12.0,lo esperado con Samsung Galaxy Tab cumple su función. 🆗
Shopify,False,user_80453,CO,Adidas,Superstar,2025-07-30 09:53:14.196741,3.0,28.927142857142858,hace su trabajo con Adidas Superstar sin más. 😐
TikTok,True,user_49500,CL,Nike,Dri-FIT,2025-07-30 11:18:32.196741,3.812,0.0,problemas constantes con Nike Dri-FIT no lo volvería a comprar.
Amazon,False,user_33510,AR,Adidas,Ultraboost 22,2025-07-30 15:15:25.196741,4.0,28.927142857142858,diseño premium con Adidas Ultraboost 22 vale la pena. ⭐ #review
MercadoLibre,False,user_71228,PE,Sony,WH-1000XM5,2025-07-30 16:19:45.196741,5.0,28.927142857142858,impresionante tecnología con Sony WH-1000XM5. 👌
X/Twitter,True,user_10867,PE,Adidas,Superstar,2025-07-30 17:37:14.196741,3.812,20.0,veremos con el tiempo con Adidas Superstar veremos con el tiempo.
Instagram,True,user_45162,CL,Nike,Air Max 270,2025-07-30 18:07:02.196741,3.812,74.0,perfecto en todos los aspectos con Nike Air Max 270 me encantó. 💯
Amazon,False,user_24129,MX,Nike,Air Max 270,2025-07-30 18:15:08.196741,4.0,28.927142857142858,muy recomendado con Nike Air Max 270 me encantó. 💯
Reddit,True,user_30542,US,Samsung,Galaxy S24,2025-07-30 21:09:13.196741,3.812,46.0,superó mis expectativas con Samsung Galaxy S24 lo volvería a comprar.
Reddit,True,user_95317,DO,Adidas,Ultraboost 22,2025-07-31 01:26:06.196741,3.812,14.0,producto estándar con Adidas Ultraboost 22. 👀 #compras
Reddit,True,user_23621,AR,Adidas,NMD,2025-07-31 01:38:16.196741,3.812,11.0,no cumple expectativas con Adidas NMD pésima experiencia. ❌
Instagram,True,user_35127,PE,Samsung,Galaxy S24,2025-07-31 02:46:43.196741,3.812,4.0,veremos con el tiempo con Samsung Galaxy S24 nada especial.
Instagram,True,user_54914,PE,Samsung,Galaxy Watch,2025-07-31 04:37:21.196741,3.812,15.0,fallas frecuentes con Samsung Galaxy Watch no lo volvería a comprar. 🤦‍♂️
Shopify,False,user_46989,DO,Sony,PlayStation 5,2025-07-31 11:13:40.196741,4.0,28.927142857142858,lo mejor que he comprado con Sony PlayStation 5 vale la pena.
MercadoLibre,False,user_76561,US,Sony,Alpha Camera,2025-07-31 14:03:53.196741,5.0,28.927142857142858,vale cada peso con Sony Alpha Camera me encantó. 😍 #sony
Reddit,True,user_89583,CO,Apple,Apple Watch,2025-07-31 14:50:24.196741,3.812,29.0,mala inversión con Apple Apple Watch eviten comprarlo.
Instagram,True,user_46941,PE,Apple,AirPods Pro,2025-07-31 21:47:10.196741,3.812,40.0,se dañó rápido con Apple AirPods Pro me arrepiento. 😠 #apple
Amazon,False,user_17861,US,Sony,WH-1000XM5,2025-08-01 00:06:54.196741,3.0,28.927142857142858,funciona correctamente con Sony WH-1000XM5 cumple su función.
MercadoLibre,False,user_80430,MX,Nike,React Infinity,2025-08-01 00:07:07.196741,3.0,28.927142857142858,calidad promedio con Nike React Infinity cumple su función. 🤔
Amazon,False,user_61007,US,Adidas,Stan Smith,2025-08-01 01:21:03.196741,5.0,28.927142857142858,lo mejor que he comprado con Adidas Stan Smith increíble producto. 🔥
MercadoLibre,False,user_82140,US,Sony,Bravia TV,2025-08-01 05:08:23.196741,5.0,28.927142857142858,diseño premium con Sony Bravia TV me encantó. 😍 #sony
Amazon,False,user_54657,ES,Adidas,NMD,2025-08-01 12:20:23.196741,4.0,28.927142857142858,impresionante tecnología con Adidas NMD excelente compra.  #review
MercadoLibre,False,user_95252,CL,Sony,PlayStation 5,2025-08-01 13:05:16.196741,5.0,28.927142857142858,impresionante tecnología con Sony PlayStation 5 súper recomendado. ⭐
Reddit,True,user_36094,US,Samsung,Galaxy S24,2025-08-01 14:06:04.196741,3.812,70.0,vale cada peso con Samsung Galaxy S24. 🎉 #recomendacion
Reddit,True,user_76412,US,Apple,AirPods Pro,2025-08-01 17:27:17.196741,3.812,8.0,no lo recomiendo con Apple AirPods Pro pésima experiencia.
Amazon,False,user_22245,ES,Sony,WF-1000XM4,2025-08-01 18:10:09.196741,3.0,28.927142857142858,calidad promedio con Sony WF-1000XM4 veremos con el tiempo. 🆗
TikTok,True,user_44803,CO,Apple,iPad Air,2025-08-01 18:38:09.196741,3.812,26.0,experiencia horrible con Apple iPad Air no lo volvería a comprar. 🤦‍♂️
TikTok,True,user_86692,CL,Apple,iPad Air,2025-08-02 02:54:40.196741,3.812,12.0,problemas constantes con Apple iPad Air busquen alternativas. 😠
TikTok,True,user_63592,CL,Apple,AirPods Pro,2025-08-02 04:35:05.196741,3.812,4.0,soporte al cliente terrible con Apple AirPods Pro me arrepiento. 😞
Reddit,True,user_29369,PE,Samsung,Galaxy Watch,2025-08-02 06:57:21.196741,3.812,5.0,sin problemas hasta ahora con Samsung Galaxy Watch. 😐
Reddit,True,user_81233,CL,Apple,iPad Air,2025-08-02 07:56:45.196741,3.812,26.0,nada extraordinario con Apple iPad Air cumple su función.  #compras
Amazon,False,user_66847,PE,Apple,MacBook Pro,2025-08-02 09:49:13.196741,4.0,28.927142857142858,diseño premium con Apple MacBook Pro. 🎉 #macbookpro
TikTok,True,user_88317,CL,Apple,AirPods Pro,2025-08-02 10:36:41.196741,3.812,61.0,excelente calidad con Apple AirPods Pro vale la pena. ✨ #review
Amazon,False,user_66472,US,Samsung,Galaxy Tab,2025-08-02 12:00:34.196741,4.0,28.927142857142858,buena relación calidad precio con Samsung Galaxy Tab. ⭐ #recomendacion
Reddit,True,user_96787,PE,Sony,PlayStation 5,2025-08-02 12:38:56.196741,3.812,0.0,producto estándar con Sony PlayStation 5 nada especial.  #playstation5
Reddit,True,user_24553,CL,Sony,Bravia TV,2025-08-02 12:40:25.196741,3.812,48.0,lo mejor que he comprado con Sony Bravia TV me encantó. ✨
Reddit,True,user_85199,ES,Sony,Bravia TV,2025-08-02 14:45:18.196741,3.812,0.0,pérdida de dinero con Sony Bravia TV pésima experiencia. 🤦‍♂️
TikTok,True,user_76321,DO,Samsung,Galaxy S24,2025-08-02 15:08:05.196741,3.812,19.0,fallas frecuentes con Samsung Galaxy S24 no lo volvería a comprar.  #recomendacion
TikTok,True,user_37379,US,Adidas,Stan Smith,2025-08-03 02:36:04.196741,3.812,48.0,impresionante tecnología con Adidas Stan Smith súper recomendado. 👍
Reddit,True,user_75377,CL,Apple,MacBook Pro,2025-08-03 05:11:58.196741,3.812,0.0,hace su trabajo con Apple MacBook Pro sin más. 🤔
Amazon,False,user_31928,ES,Samsung,QLED TV,2025-08-03 10:22:32.196741,4.0,28.927142857142858,tal como se describe con Samsung QLED TV nada especial.
TikTok,True,user_96190,MX,Adidas,Superstar,2025-08-03 10:46:14.196741,3.812,0.0,tal como se describe con Adidas Superstar sin más.  #tech
Amazon,False,user_74955,ES,Nike,Dri-FIT,2025-08-03 10:56:23.196741,5.0,28.927142857142858,perfecto en todos los aspectos con Nike Dri-FIT excelente compra. 🎉
Reddit,True,user_75070,MX,Adidas,Predator,2025-08-03 11:40:03.196741,3.812,47.0,muy recomendado con Adidas Predator me encantó. ⭐
Reddit,True,user_56052,AR,Apple,AirPods Pro,2025-08-03 12:39:44.196741,3.812,24.0,mala inversión con Apple AirPods Pro.  #recomendacion
Shopify,False,user_80932,DO,Sony,WH-1000XM5,2025-08-03 16:43:30.196741,4.0,28.927142857142858,diseño premium con Sony WH-1000XM5 excelente compra. ✨
Shopify,False,user_98440,PE,Sony,Alpha Camera,2025-08-03 16:49:30.196741,4.0,28.927142857142858,lo esperado con Sony Alpha Camera nada especial. 😐
X/Twitter,True,user_82494,CL,Sony,Alpha Camera,2025-08-03 18:03:45.196741,3.812,38.0,entrega rápida con Sony Alpha Camera excelente compra. 😍
TikTok,True,user_39842,CL,Samsung,Galaxy Buds,2025-08-03 22:56:23.196741,3.812,43.0,entrega rápida con Samsung Galaxy Buds lo volvería a comprar.  #compras
Instagram,True,user_99950,AR,Sony,Bravia TV,2025-08-04 02:03:17.196741,3.812,22.0,experiencia horrible con Sony Bravia TV.  #sony
Shopify,False,user_85398,AR,Sony,WH-1000XM5,2025-08-04 02:32:31.196741,2.0,28.927142857142858,duración pésima con Sony WH-1000XM5 pésima experiencia. 😤 #review
Shopify,False,user_21413,US,Apple,iPad Air,2025-08-04 07:49:52.196741,5.0,28.927142857142858,excelente calidad con Apple iPad Air excelente compra. ✨
MercadoLibre,False,user_93599,MX,Samsung,QLED TV,2025-08-04 08:15:41.196741,4.0,28.927142857142858,lo mejor que he comprado con Samsung QLED TV me encantó. ✨
Instagram,True,user_34890,AR,Adidas,Superstar,2025-08-04 08:51:19.196741,3.812,39.0,excelente calidad con Adidas Superstar lo volvería a comprar.
TikTok,True,user_56281,DO,Samsung,Galaxy Buds,2025-08-04 08:52:51.196741,3.812,38.0,demasiado caro para lo que ofrece con Samsung Galaxy Buds pésima experiencia. 😤 #tech
Shopify,False,user_76965,CO,Samsung,Galaxy Tab,2025-08-04 10:21:54.196741,4.0,28.927142857142858,superó mis expectativas con Samsung Galaxy Tab increíble producto. 💯 #tech
Reddit,True,user_14285,AR,Apple,MacBook Pro,2025-08-04 14:23:48.196741,3.812,0.0,buena relación calidad precio con Apple MacBook Pro increíble producto. 🔥
Shopify,False,user_37742,AR,Samsung,Galaxy S24,2025-08-04 15:13:46.196741,5.0,28.927142857142858,excelente calidad con Samsung Galaxy S24 me encantó. 😍
Shopify,False,user_29405,MX,Nike,Air Max 270,2025-08-04 15:40:33.196741,5.0,28.927142857142858,entrega rápida con Nike Air Max 270 súper recomendado. 😍
Reddit,True,user_21836,PE,Nike,Air Force 1,2025-08-04 20:04:53.196741,3.812,69.0,rendimiento excepcional con Nike Air Force 1 vale la pena. ✨
Amazon,False,user_59006,MX,Sony,WF-1000XM4,2025-08-04 22:14:22.196741,4.0,28.927142857142858,funciona de maravilla con Sony WF-1000XM4 súper recomendado. 👌
MercadoLibre,False,user_67695,ES,Nike,Air Jordan,2025-08-05 01:51:26.196741,5.0,28.927142857142858,lo mejor que he comprado con Nike Air Jordan. ⭐
X/Twitter,True,user_26864,MX,Adidas,Predator,2025-08-05 03:00:54.196741,3.812,64.0,perfecto en todos los aspectos con Adidas Predator excelente compra. ⭐
Amazon,False,user_15881,CL,Apple,iPad Air,2025-08-05 08:13:48.196741,4.0,28.927142857142858,duración increíble con Apple iPad Air me encantó. ✨ #review
X/Twitter,True,user_62007,US,Adidas,Predator,2025-08-05 14:56:44.196741,3.812,21.0,hace su trabajo con Adidas Predator sin más. 👀
TikTok,True,user_25855,DO,Sony,Alpha Camera,2025-08-05 15:12:23.196741,3.812,56.0,perfecto en todos los aspectos con Sony Alpha Camera excelente compra.  #compras
Shopify,False,user_23606,MX,Apple,iPhone 15,2025-08-05 18:47:50.196741,3.0,28.927142857142858,calidad promedio con Apple iPhone 15.
Instagram,True,user_20670,CL,Adidas,Superstar,2025-08-05 19:36:48.196741,3.812,0.0,experiencia horrible con Adidas Superstar no lo volvería a comprar. 💔
MercadoLibre,False,user_67366,DO,Adidas,Stan Smith,2025-08-05 22:38:44.196741,4.0,28.927142857142858,superó mis expectativas con Adidas Stan Smith vale la pena. 💯
Reddit,True,user_96781,CL,Nike,Air Jordan,2025-08-06 00:16:12.196741,3.812,7.0,veremos con el tiempo con Nike Air Jordan sin más.
Amazon,False,user_78493,PE,Apple,iPad Air,2025-08-06 02:47:22.196741,5.0,28.927142857142858,funciona de maravilla con Apple iPad Air excelente compra. 🔥
TikTok,True,user_42541,ES,Nike,Air Force 1,2025-08-06 04:19:48.196741,3.812,27.0,fallas frecuentes con Nike Air Force 1 busquen alternativas.
Shopify,False,user_68090,US,Sony,PlayStation 5,2025-08-06 06:01:35.196741,4.0,28.927142857142858,lo esperado con Sony PlayStation 5 veremos con el tiempo. 🆗
X/Twitter,True,user_54077,AR,Apple,Apple Watch,2025-08-06 06:45:19.196741,3.812,22.0,veremos con el tiempo con Apple Apple Watch nada especial.  #compras
Instagram,True,user_11105,MX,Sony,Bravia TV,2025-08-06 07:32:14.196741,3.812,21.0,está bien por el precio con Sony Bravia TV.  #sony
X/Twitter,True,user_92873,MX,Sony,Bravia TV,2025-08-06 08:29:28.196741,3.812,43.0,vale cada peso con Sony Bravia TV. ⭐
X/Twitter,True,user_54623,CO,Samsung,Galaxy Tab,2025-08-06 08:33:45.196741,3.812,22.0,problemas constantes con Samsung Galaxy Tab eviten comprarlo.
Shopify,False,user_66244,DO,Adidas,Stan Smith,2025-08-06 08:46:37.196741,4.0,28.927142857142858,hace su trabajo con Adidas Stan Smith.  #tech
X/Twitter,True,user_84536,DO,Sony,WH-1000XM5,2025-08-06 09:03:12.196741,3.812,29.0,muy recomendado con Sony WH-1000XM5 vale la pena. 👌
MercadoLibre,False,user_57735,AR,Apple,iPhone 15,2025-08-06 12:50:22.196741,4.0,28.927142857142858,buena relación calidad precio con Apple iPhone 15 excelente compra. ⭐
X/Twitter,True,user_19323,ES,Sony,Alpha Camera,2025-08-06 13:30:15.196741,3.812,8.0,defectuoso desde el inicio con Sony Alpha Camera me arrepiento. 😞
TikTok,True,user_16705,CO,Sony,PlayStation 5,2025-08-06 16:06:08.196741,3.812,20.0,buena relación calidad precio con Sony PlayStation 5 vale la pena. ✨
Reddit,True,user_62354,CL,Nike,Air Max 270,2025-08-06 17:37:06.196741,3.812,10.0,tal como se describe con Nike Air Max 270 veremos con el tiempo. 😐
Reddit,True,user_85246,CO,Samsung,QLED TV,2025-08-06 20:04:51.196741,3.812,15.0,sin problemas hasta ahora con Samsung QLED TV nada especial. 👀
TikTok,True,user_84498,PE,Sony,WH-1000XM5,2025-08-07 00:49:53.196741,3.812,7.0,superó mis expectativas con Sony WH-1000XM5 increíble producto. 🔥
Shopify,False,user_42631,PE,Apple,iPhone 15,2025-08-07 02:21:58.196741,3.0,28.927142857142858,sin problemas hasta ahora con Apple iPhone 15. 👀 #tech
Shopify,False,user_28102,AR,Adidas,Stan Smith,2025-08-07 03:30:15.196741,3.0,28.927142857142858,lo esperado con Adidas Stan Smith cumple su función. 🆗
X/Twitter,True,user_62963,DO,Nike,Dri-FIT,2025-08-07 06:50:08.196741,3.812,17.0,duración pésima con Nike Dri-FIT no lo volvería a comprar.
Amazon,False,user_41525,CL,Apple,iPad Air,2025-08-07 08:33:21.196741,3.0,28.927142857142858,veremos con el tiempo con Apple iPad Air cumple su función.  #review
Instagram,True,user_41266,ES,Apple,iPad Air,2025-08-07 09:58:54.196741,3.812,15.0,tal como se describe con Apple iPad Air cumple su función. 👀
MercadoLibre,False,user_92132,MX,Samsung,Galaxy Buds,2025-08-07 17:02:14.196741,3.0,28.927142857142858,cumple lo básico con Samsung Galaxy Buds sin más. 🤔
Shopify,False,user_13718,MX,Adidas,Ultraboost 22,2025-08-07 17:14:55.196741,5.0,28.927142857142858,superó mis expectativas con Adidas Ultraboost 22 me encantó.
Amazon,False,user_93040,CL,Apple,MacBook Pro,2025-08-07 17:52:57.196741,5.0,28.927142857142858,lo mejor que he comprado con Apple MacBook Pro increíble producto. ⭐ #compras
MercadoLibre,False,user_46106,US,Nike,Air Jordan,2025-08-07 19:26:46.196741,4.0,28.927142857142858,muy recomendado con Nike Air Jordan me encantó.
Instagram,True,user_76046,AR,Samsung,Galaxy S24,2025-08-07 20:40:36.196741,3.812,66.0,impresionante tecnología con Samsung Galaxy S24 me encantó.
Instagram,True,user_22653,MX,Apple,MacBook Pro,2025-08-07 22:38:31.196741,3.812,26.0,hace su trabajo con Apple MacBook Pro nada especial.
TikTok,True,user_47047,US,Sony,WF-1000XM4,2025-08-08 02:22:26.196741,3.812,22.0,ni muy bueno ni muy malo con Sony WF-1000XM4 sin más. 😐 #compras
MercadoLibre,False,user_33260,US,Samsung,Galaxy Buds,2025-08-08 02:42:49.196741,5.0,28.927142857142858,funciona de maravilla con Samsung Galaxy Buds lo volvería a comprar.
Reddit,True,user_85148,CL,Samsung,Galaxy S24,2025-08-08 04:05:48.196741,3.812,46.0,impresionante tecnología con Samsung Galaxy S24 me encantó. 🎉
MercadoLibre,False,user_85809,MX,Samsung,Galaxy Tab,2025-08-08 04:26:40.196741,5.0,28.927142857142858,lo mejor que he comprado con Samsung Galaxy Tab vale la pena. 💯
X/Twitter,True,user_19307,MX,Sony,WF-1000XM4,2025-08-08 04:41:27.196741,3.812,4.0,ni muy bueno ni muy malo con Sony WF-1000XM4 veremos con el tiempo. 🆗 #compras
Shopify,False,user_53665,ES,Nike,Air Max 270,2025-08-08 04:42:47.196741,3.0,28.927142857142858,está bien por el precio con Nike Air Max 270. 👀
MercadoLibre,False,user_81875,PE,Adidas,Ultraboost 22,2025-08-08 06:58:11.196741,4.0,28.927142857142858,superó mis expectativas con Adidas Ultraboost 22 me encantó. ✨
Amazon,False,user_90962,MX,Nike,Air Max 270,2025-08-08 07:41:49.196741,5.0,28.927142857142858,perfecto en todos los aspectos con Nike Air Max 270 vale la pena. ✨ #airmax270
X/Twitter,True,user_64529,CL,Apple,MacBook Pro,2025-08-08 10:27:17.196741,3.812,21.0,no cumple expectativas con Apple MacBook Pro no lo volvería a comprar. 🤦‍♂️
X/Twitter,True,user_27047,CO,Samsung,QLED TV,2025-08-08 11:00:20.196741,3.812,13.0,soporte al cliente terrible con Samsung QLED TV eviten comprarlo. 🤦‍♂️
MercadoLibre,False,user_14726,US,Adidas,Stan Smith,2025-08-08 11:10:58.196741,5.0,28.927142857142858,excelente calidad con Adidas Stan Smith. 🔥
MercadoLibre,False,user_60328,CL,Adidas,Stan Smith,2025-08-08 12:02:27.196741,5.0,28.927142857142858,funciona de maravilla con Adidas Stan Smith lo volvería a comprar.  #adidas
MercadoLibre,False,user_88390,CL,Apple,MacBook Pro,2025-08-09 00:22:06.196741,3.0,28.927142857142858,producto estándar con Apple MacBook Pro nada especial. 🆗
Reddit,True,user_70810,PE,Nike,Air Max 270,2025-08-09 06:20:34.196741,3.812,36.0,no cumple expectativas con Nike Air Max 270. 😡
Shopify,False,user_96413,MX,Nike,Air Jordan,2025-08-09 09:39:51.196741,3.0,28.927142857142858,sin problemas hasta ahora con Nike Air Jordan. 🆗 #recomendacion
Reddit,True,user_52318,AR,Samsung,Galaxy Tab,2025-08-09 09:45:59.196741,3.812,14.0,experiencia fantástica con Samsung Galaxy Tab excelente compra. 🔥
