platform,is_social,user_id,country,brand,product,timestamp,rating,likes,text
Shopify,False,user_34450,CL,Apple,iPad Air,2025-07-08 18:43:05.196741,5.0,28.927142857142858,vale cada peso con Apple iPad Air me encantó. 👌
TikTok,True,user_11821,CO,Adidas,Ultraboost 22,2025-07-08 22:10:31.196741,3.812,22.0,pérdida de dinero con Adidas Ultraboost 22 busquen alternativas. 👎
MercadoLibre,False,user_46048,CO,Apple,iPhone 15,2025-07-09 01:25:43.196741,5.0,28.927142857142858,lo mejor que he comprado con Apple iPhone 15 lo volvería a comprar. ✨
Reddit,True,user_34182,CO,Nike,React Infinity,2025-07-09 04:22:35.196741,3.812,0.0,cumple lo básico con Nike React Infinity nada especial.  #recomendacion
TikTok,True,user_46739,PE,Samsung,Galaxy Buds,2025-07-09 04:32:05.196741,3.812,102.0,impresionante tecnología con Samsung Galaxy Buds súper recomendado.
X/Twitter,True,user_53397,CO,Samsung,Galaxy S24,2025-07-09 07:30:34.196741,3.812,16.0,soporte al cliente terrible con Samsung Galaxy S24 busquen alternativas.
Instagram,True,user_89071,DO,Adidas,Superstar,2025-07-09 10:27:58.196741,3.812,69.0,diseño premium con Adidas Superstar súper recomendado. 😍
TikTok,True,user_27548,AR,Adidas,Ultraboost 22,2025-07-09 12:04:28.196741,3.812,15.0,está bien por el precio con Adidas Ultraboost 22 nada especial. 😐
X/Twitter,True,user_52132,PE,Sony,WH-1000XM5,2025-07-09 14:08:57.196741,3.812,19.0,demasiado caro para lo que ofrece con Sony WH-1000XM5 eviten comprarlo. 😤
TikTok,True,user_75459,ES,Apple,iPhone 15,2025-07-09 15:09:57.196741,3.812,4.0,fallas frecuentes con Apple iPhone 15 no lo volvería a comprar. ❌ #tech
Amazon,False,user_89007,MX,Apple,AirPods Pro,2025-07-09 15:20:12.196741,2.0,28.927142857142858,duración pésima con Apple AirPods Pro me arrepiento. 😞
X/Twitter,True,user_91959,AR,Samsung,QLED TV,2025-07-09 15:46:16.196741,3.812,13.0,se dañó rápido con Samsung QLED TV no lo volvería a comprar.  #qledtv
Amazon,False,user_21592,CO,Apple,iPad Air,2025-07-09 17:07:55.196741,4.0,28.927142857142858,lo mejor que he comprado con Apple iPad Air lo volvería a comprar.  #tech
X/Twitter,True,user_85751,CL,Nike,Air Force 1,2025-07-09 17:11:18.196741,3.812,19.0,entrega tardía con Nike Air Force 1 pésima experiencia.
MercadoLibre,False,user_13251,AR,Apple,MacBook Pro,2025-07-09 17:36:19.196741,4.0,28.927142857142858,muy recomendado con Apple MacBook Pro excelente compra.  #compras
Instagram,True,user_56160,ES,Nike,Dri-FIT,2025-07-09 18:51:49.196741,3.812,72.0,rendimiento excepcional con Nike Dri-FIT súper recomendado. 👌
Instagram,True,user_44815,MX,Samsung,Galaxy Tab,2025-07-09 18:54:06.196741,3.812,53.0,muy recomendado con Samsung Galaxy Tab increíble producto. 😍
MercadoLibre,False,user_42943,CO,Apple,iPhone 15,2025-07-09 22:26:28.196741,4.0,28.927142857142858,sin problemas hasta ahora con Apple iPhone 15 nada especial. 👀
X/Twitter,True,user_12767,PE,Adidas,Predator,2025-07-10 01:29:19.196741,3.812,96.0,lo mejor que he comprado con Adidas Predator me encantó. ⭐
Shopify,False,user_74752,DO,Samsung,Galaxy Watch,2025-07-10 03:28:12.196741,5.0,28.927142857142858,experiencia fantástica con Samsung Galaxy Watch vale la pena. ⭐
Reddit,True,user_32715,PE,Sony,WF-1000XM4,2025-07-10 05:07:35.196741,3.812,14.0,producto estándar con Sony WF-1000XM4 veremos con el tiempo. 🆗 #recomendacion
X/Twitter,True,user_35701,PE,Adidas,Stan Smith,2025-07-10 05:31:03.196741,3.812,31.0,buena relación calidad precio con Adidas Stan Smith excelente compra.
MercadoLibre,False,user_24170,DO,Adidas,Ultraboost 22,2025-07-10 07:19:00.196741,4.0,28.927142857142858,muy recomendado con Adidas Ultraboost 22 vale la pena. 🎉
MercadoLibre,False,user_82955,CO,Sony,Bravia TV,2025-07-10 08:52:44.196741,5.0,28.927142857142858,experiencia fantástica con Sony Bravia TV me encantó. ✨
Amazon,False,user_86183,DO,Apple,Apple Watch,2025-07-10 10:55:28.196741,4.0,28.927142857142858,funciona correctamente con Apple Apple Watch veremos con el tiempo. 👀
Shopify,False,user_61684,ES,Nike,React Infinity,2025-07-10 11:04:21.196741,4.0,28.927142857142858,muy recomendado con Nike React Infinity excelente compra. 👌
Shopify,False,user_93705,US,Nike,Air Max 270,2025-07-10 11:20:37.196741,3.0,28.927142857142858,ni muy bueno ni muy malo con Nike Air Max 270.  #airmax270
MercadoLibre,False,user_49132,CL,Apple,AirPods Pro,2025-07-10 16:12:45.196741,2.0,28.927142857142858,defectuoso desde el inicio con Apple AirPods Pro me arrepiento.
TikTok,True,user_88974,AR,Samsung,Galaxy Watch,2025-07-10 19:01:28.196741,3.812,23.0,se dañó rápido con Samsung Galaxy Watch busquen alternativas. ❌
X/Twitter,True,user_67923,DO,Apple,MacBook Pro,2025-07-11 00:07:10.196741,3.812,0.0,superó mis expectativas con Apple MacBook Pro. 🎉 #apple
X/Twitter,True,user_70191,US,Apple,MacBook Pro,2025-07-11 01:25:08.196741,3.812,57.0,muy recomendado con Apple MacBook Pro súper recomendado. 👍
Instagram,True,user_62469,ES,Sony,Bravia TV,2025-07-11 01:57:34.196741,3.812,21.0,muy mala calidad con Sony Bravia TV. ❌ #sony
TikTok,True,user_67917,MX,Nike,Dri-FIT,2025-07-11 04:51:27.196741,3.812,17.0,cumple lo básico con Nike Dri-FIT sin más. 👀 #tech
Amazon,False,user_90147,CL,Samsung,Galaxy Tab,2025-07-11 09:30:46.196741,3.0,28.927142857142858,pérdida de dinero con Samsung Galaxy Tab busquen alternativas. 👎 #galaxytab
X/Twitter,True,user_66418,AR,Nike,React Infinity,2025-07-11 12:13:31.196741,3.812,32.0,cumple lo básico con Nike React Infinity veremos con el tiempo.
Reddit,True,user_25559,CL,Nike,Dri-FIT,2025-07-11 15:49:08.196741,3.812,15.0,muy mala calidad con Nike Dri-FIT me arrepiento. 💔
TikTok,True,user_64257,DO,Adidas,NMD,2025-07-11 15:49:29.196741,3.812,10.0,demasiado caro para lo que ofrece con Adidas NMD busquen alternativas.
Instagram,True,user_60039,AR,Samsung,Galaxy Watch,2025-07-11 22:17:30.196741,3.812,0.0,cumple lo básico con Samsung Galaxy Watch sin más.
Amazon,False,user_31854,US,Samsung,QLED TV,2025-07-11 22:19:31.196741,5.0,28.927142857142858,soporte al cliente excelente con Samsung QLED TV increíble producto. 👍
X/Twitter,True,user_76895,CL,Adidas,Superstar,2025-07-12 00:23:45.196741,3.812,16.0,defectuoso desde el inicio con Adidas Superstar eviten comprarlo. 😠
Instagram,True,user_64938,PE,Sony,Alpha Camera,2025-07-12 00:47:24.196741,3.812,0.0,funciona correctamente con Sony Alpha Camera nada especial.
Shopify,False,user_89988,PE,Adidas,NMD,2025-07-12 10:22:33.196741,5.0,28.927142857142858,funciona de maravilla con Adidas NMD increíble producto. 💯 #adidas
MercadoLibre,False,user_24068,CL,Nike,Dri-FIT,2025-07-12 10:48:53.196741,4.0,28.927142857142858,soporte al cliente excelente con Nike Dri-FIT. 🔥 #nike
Amazon,False,user_66854,AR,Nike,Air Jordan,2025-07-12 11:26:49.196741,5.0,28.927142857142858,perfecto en todos los aspectos con Nike Air Jordan excelente compra. 👌
Reddit,True,user_45882,US,Samsung,Galaxy S24,2025-07-12 12:53:23.196741,3.812,44.0,diseño premium con Samsung Galaxy S24 increíble producto.
X/Twitter,True,user_81766,US,Nike,Air Max 270,2025-07-12 13:45:37.196741,3.812,16.0,excelente calidad con Nike Air Max 270 vale la pena. 🎉
Reddit,True,user_73682,CL,Apple,MacBook Pro,2025-07-12 17:12:07.196741,3.812,47.0,superó mis expectativas con Apple MacBook Pro lo volvería a comprar. 😍
MercadoLibre,False,user_99505,PE,Nike,Air Max 270,2025-07-12 19:19:22.196741,5.0,28.927142857142858,experiencia fantástica con Nike Air Max 270.
Reddit,True,user_72105,DO,Apple,iPad Air,2025-07-12 20:07:09.196741,3.812,15.0,está bien por el precio con Apple iPad Air.  #apple
Instagram,True,user_19248,AR,Samsung,QLED TV,2025-07-12 20:30:08.196741,3.812,13.0,pérdida de dinero con Samsung QLED TV no lo volvería a comprar.
Reddit,True,user_17355,AR,Apple,iPhone 15,2025-07-12 20:38:27.196741,3.812,32.0,soporte al cliente excelente con Apple iPhone 15 súper recomendado. 🔥
X/Twitter,True,user_75147,PE,Samsung,Galaxy Tab,2025-07-12 23:14:05.196741,3.812,26.0,problemas constantes con Samsung Galaxy Tab busquen alternativas.  #galaxytab
TikTok,True,user_37594,PE,Samsung,Galaxy Tab,2025-07-13 03:24:59.196741,3.812,3.0,duración pésima con Samsung Galaxy Tab me arrepiento. ❌ #galaxytab
MercadoLibre,False,user_33176,US,Nike,React Infinity,2025-07-13 04:20:06.196741,3.0,28.927142857142858,cumple lo básico con Nike React Infinity nada especial.  #reactinfinity
Amazon,False,user_83080,CL,Samsung,Galaxy Tab,2025-07-13 10:38:01.196741,4.0,28.927142857142858,rendimiento excepcional con Samsung Galaxy Tab vale la pena.  #review
Amazon,False,user_82250,CO,Nike,Dri-FIT,2025-07-13 11:35:32.196741,5.0,28.927142857142858,vale cada peso con Nike Dri-FIT excelente compra.
Instagram,True,user_82154,PE,Apple,iPad Air,2025-07-13 12:54:10.196741,3.812,24.0,entrega rápida con Apple iPad Air vale la pena. ✨
Amazon,False,user_38940,ES,Samsung,Galaxy Buds,2025-07-13 14:53:30.196741,4.0,28.927142857142858,lo mejor que he comprado con Samsung Galaxy Buds vale la pena. 🎉
Shopify,False,user_33385,ES,Nike,React Infinity,2025-07-13 18:08:22.196741,5.0,28.927142857142858,lo mejor que he comprado con Nike React Infinity vale la pena. 💯
Shopify,False,user_86230,CO,Sony,WH-1000XM5,2025-07-13 19:57:01.196741,4.0,28.927142857142858,buena relación calidad precio con Sony WH-1000XM5 increíble producto.
Reddit,True,user_92180,US,Apple,AirPods Pro,2025-07-13 21:48:45.196741,3.812,35.0,perfecto en todos los aspectos con Apple AirPods Pro.
X/Twitter,True,user_88333,AR,Sony,WH-1000XM5,2025-07-14 04:24:19.196741,3.812,31.0,experiencia horrible con Sony WH-1000XM5. 😞
Shopify,False,user_70655,AR,Adidas,Superstar,2025-07-14 06:46:15.196741,4.0,28.927142857142858,soporte al cliente excelente con Adidas Superstar súper recomendado. 💯
Reddit,True,user_94125,CL,Adidas,NMD,2025-07-14 10:57:50.196741,3.812,0.0,no cumple expectativas con Adidas NMD. 😠
TikTok,True,user_35873,MX,Nike,Air Max 270,2025-07-14 12:44:13.196741,3.812,32.0,está bien por el precio con Nike Air Max 270 nada especial.
Amazon,False,user_75542,AR,Samsung,QLED TV,2025-07-14 14:48:14.196741,5.0,28.927142857142858,excelente calidad con Samsung QLED TV lo volvería a comprar.
Shopify,False,user_55928,MX,Samsung,Galaxy Watch,2025-07-14 19:57:29.196741,4.0,28.927142857142858,buena relación calidad precio con Samsung Galaxy Watch vale la pena. 🔥 #tech
Reddit,True,user_56840,PE,Apple,Apple Watch,2025-07-15 01:47:00.196741,3.812,78.0,superó mis expectativas con Apple Apple Watch súper recomendado. 💯 #review
Instagram,True,user_81820,ES,Samsung,QLED TV,2025-07-15 12:38:43.196741,3.812,48.0,soporte al cliente terrible con Samsung QLED TV pésima experiencia. 💔 #tech
Amazon,False,user_58200,ES,Samsung,Galaxy S24,2025-07-15 16:01:10.196741,2.0,28.927142857142858,soporte al cliente terrible con Samsung Galaxy S24 busquen alternativas.  #samsung
Instagram,True,user_30715,DO,Apple,iPad Air,2025-07-15 17:08:42.196741,3.812,17.0,tal como se describe con Apple iPad Air veremos con el tiempo. 😐
TikTok,True,user_47643,DO,Nike,React Infinity,2025-07-15 22:45:52.196741,3.812,2.0,cumple lo básico con Nike React Infinity. 👀
Amazon,False,user_43425,DO,Samsung,Galaxy Watch,2025-07-16 00:38:15.196741,4.0,28.927142857142858,lo mejor que he comprado con Samsung Galaxy Watch. 🔥 #review
X/Twitter,True,user_28844,DO,Apple,AirPods Pro,2025-07-16 01:54:25.196741,3.812,10.0,calidad promedio con Apple AirPods Pro. 😐
Reddit,True,user_33426,AR,Apple,iPad Air,2025-07-16 02:11:02.196741,3.812,74.0,excelente calidad con Apple iPad Air me encantó. 👌 #apple
X/Twitter,True,user_38389,CL,Apple,AirPods Pro,2025-07-16 03:38:53.196741,3.812,6.0,sin problemas hasta ahora con Apple AirPods Pro veremos con el tiempo.  #recomendacion
Shopify,False,user_94230,CO,Apple,Apple Watch,2025-07-16 07:19:56.196741,3.0,28.927142857142858,hace su trabajo con Apple Apple Watch.  #recomendacion
Amazon,False,user_85492,PE,Adidas,Superstar,2025-07-16 09:18:59.196741,3.0,28.927142857142858,sin problemas hasta ahora con Adidas Superstar nada especial. 👀
Shopify,False,user_61060,ES,Samsung,Galaxy Buds,2025-07-16 11:18:53.196741,5.0,28.927142857142858,lo mejor que he comprado con Samsung Galaxy Buds increíble producto.
MercadoLibre,False,user_91777,US,Apple,AirPods Pro,2025-07-16 13:55:01.196741,4.0,28.927142857142858,impresionante tecnología con Apple AirPods Pro vale la pena. 💯
Instagram,True,user_43119,ES,Samsung,Galaxy Buds,2025-07-16 14:25:41.196741,3.812,30.0,problemas constantes con Samsung Galaxy Buds. 😡
Reddit,True,user_25970,DO,Sony,WH-1000XM5,2025-07-16 15:49:56.196741,3.812,56.0,superó mis expectativas con Sony WH-1000XM5 vale la pena.  #recomendacion
MercadoLibre,False,user_41757,CL,Apple,iPad Air,2025-07-17 01:59:34.196741,4.0,28.927142857142858,vale cada peso con Apple iPad Air increíble producto. 😍 #apple
MercadoLibre,False,user_50749,DO,Samsung,Galaxy Buds,2025-07-17 02:21:22.196741,4.0,28.927142857142858,calidad promedio con Samsung Galaxy Buds. 👀 #galaxybuds
Shopify,False,user_74175,MX,Sony,WF-1000XM4,2025-07-17 02:45:19.196741,4.0,28.927142857142858,lo mejor que he comprado con Sony WF-1000XM4 increíble producto.  #review
Instagram,True,user_25538,AR,Sony,Alpha Camera,2025-07-17 02:47:30.196741,3.812,30.0,diseño premium con Sony Alpha Camera súper recomendado. 💯 #review
Reddit,True,user_98761,PE,Samsung,Galaxy Tab,2025-07-17 08:07:59.196741,3.812,9.0,cumple lo básico con Samsung Galaxy Tab sin más.
Instagram,True,user_17165,US,Nike,Dri-FIT,2025-07-17 08:49:31.196741,3.812,29.0,está bien por el precio con Nike Dri-FIT.  #review
MercadoLibre,False,user_48671,US,Sony,PlayStation 5,2025-07-17 10:15:00.196741,3.0,28.927142857142858,está bien por el precio con Sony PlayStation 5 cumple su función. 🆗 #tech
Amazon,False,user_92978,US,Samsung,Galaxy Buds,2025-07-17 11:55:06.196741,4.0,28.927142857142858,experiencia fantástica con Samsung Galaxy Buds me encantó.
Shopify,False,user_26483,ES,Apple,iPad Air,2025-07-17 12:02:15.196741,2.0,28.927142857142858,lo esperado con Apple iPad Air nada especial. 🆗
MercadoLibre,False,user_49930,MX,Adidas,Superstar,2025-07-17 13:49:27.196741,5.0,28.927142857142858,superó mis expectativas con Adidas Superstar súper recomendado.  #tech
Shopify,False,user_47498,US,Adidas,Ultraboost 22,2025-07-17 13:50:27.196741,2.0,28.927142857142858,demasiado caro para lo que ofrece con Adidas Ultraboost 22 busquen alternativas. 😡
Amazon,False,user_30027,ES,Sony,WF-1000XM4,2025-07-17 13:52:37.196741,5.0,28.927142857142858,diseño premium con Sony WF-1000XM4 vale la pena. 😍 #compras
Amazon,False,user_37159,AR,Nike,Air Jordan,2025-07-17 13:55:06.196741,3.0,28.927142857142858,tal como se describe con Nike Air Jordan veremos con el tiempo.  #airjordan
Amazon,False,user_10688,MX,Nike,Dri-FIT,2025-07-17 15:15:23.196741,4.0,28.927142857142858,entrega rápida con Nike Dri-FIT excelente compra. 🔥
Amazon,False,user_49446,PE,Samsung,QLED TV,2025-07-17 19:08:45.196741,4.0,28.927142857142858,excelente calidad con Samsung QLED TV me encantó. 😍 #compras
Instagram,True,user_60465,US,Sony,WH-1000XM5,2025-07-17 19:09:24.196741,3.812,74.0,soporte al cliente excelente con Sony WH-1000XM5 lo volvería a comprar. 👌
TikTok,True,user_82999,CO,Sony,WH-1000XM5,2025-07-18 02:34:18.196741,3.812,9.0,no lo recomiendo con Sony WH-1000XM5 pésima experiencia. ❌
MercadoLibre,False,user_42421,PE,Apple,AirPods Pro,2025-07-18 04:01:10.196741,5.0,28.927142857142858,lo mejor que he comprado con Apple AirPods Pro lo volvería a comprar. ✨
Instagram,True,user_25789,ES,Adidas,Stan Smith,2025-07-18 04:54:11.196741,3.812,84.0,buena relación calidad precio con Adidas Stan Smith súper recomendado. 💯
Instagram,True,user_34632,MX,Nike,React Infinity,2025-07-18 06:26:30.196741,3.812,42.0,excelente calidad con Nike React Infinity excelente compra.  #compras
Reddit,True,user_38143,ES,Nike,Air Jordan,2025-07-18 06:29:34.196741,3.812,56.0,diseño premium con Nike Air Jordan. 🔥
Reddit,True,user_15788,ES,Sony,PlayStation 5,2025-07-18 07:21:36.196741,3.812,1.0,veremos con el tiempo con Sony PlayStation 5 cumple su función.  #review
TikTok,True,user_11213,AR,Adidas,Superstar,2025-07-18 10:24:57.196741,3.812,55.0,buena relación calidad precio con Adidas Superstar me encantó.
Instagram,True,user_58487,ES,Samsung,Galaxy Tab,2025-07-18 11:37:26.196741,3.812,20.0,calidad promedio con Samsung Galaxy Tab veremos con el tiempo. 🤔 #tech
TikTok,True,user_89802,US,Adidas,NMD,2025-07-18 17:19:49.196741,3.812,21.0,experiencia fantástica con Adidas NMD me encantó.
X/Twitter,True,user_36522,PE,Samsung,Galaxy S24,2025-07-18 17:51:12.196741,3.812,12.0,experiencia horrible con Samsung Galaxy S24 no lo volvería a comprar. 💔
X/Twitter,True,user_19813,AR,Samsung,Galaxy Buds,2025-07-18 17:52:19.196741,3.812,0.0,no cumple expectativas con Samsung Galaxy Buds no lo volvería a comprar. 😞
TikTok,True,user_83575,DO,Adidas,Predator,2025-07-18 18:03:18.196741,3.812,44.0,duración increíble con Adidas Predator súper recomendado. 👌
TikTok,True,user_63714,CO,Apple,AirPods Pro,2025-07-18 18:09:24.196741,3.812,13.0,nada extraordinario con Apple AirPods Pro. 👀
MercadoLibre,False,user_31511,CL,Apple,iPad Air,2025-07-18 20:17:11.196741,4.0,28.927142857142858,entrega rápida con Apple iPad Air lo volvería a comprar.  #recomendacion
Shopify,False,user_74972,AR,Nike,Dri-FIT,2025-07-18 20:46:08.196741,5.0,28.927142857142858,soporte al cliente excelente con Nike Dri-FIT excelente compra. 👌
X/Twitter,True,user_99849,CL,Apple,iPad Air,2025-07-19 00:51:54.196741,3.812,25.0,lo mejor que he comprado con Apple iPad Air me encantó. 😍 #apple
X/Twitter,True,user_64558,AR,Nike,Air Max 270,2025-07-19 07:10:14.196741,3.812,62.0,lo mejor que he comprado con Nike Air Max 270 increíble producto. 👌
Instagram,True,user_92306,CL,Samsung,Galaxy S24,2025-07-19 09:43:56.196741,3.812,11.0,calidad promedio con Samsung Galaxy S24 sin más.
MercadoLibre,False,user_76450,AR,Samsung,QLED TV,2025-07-19 10:52:18.196741,4.0,28.927142857142858,duración increíble con Samsung QLED TV excelente compra.
MercadoLibre,False,user_99881,DO,Samsung,Galaxy Watch,2025-07-19 18:32:24.196741,4.0,28.927142857142858,superó mis expectativas con Samsung Galaxy Watch lo volvería a comprar. ✨
TikTok,True,user_39933,US,Sony,WH-1000XM5,2025-07-19 20:05:12.196741,3.812,21.0,soporte al cliente terrible con Sony WH-1000XM5 no lo volvería a comprar. 👎 #wh-1000xm5
TikTok,True,user_56140,CO,Nike,Air Force 1,2025-07-20 02:31:12.196741,3.812,36.0,experiencia fantástica con Nike Air Force 1 me encantó. 😍
Amazon,False,user_37619,AR,Sony,PlayStation 5,2025-07-20 04:18:24.196741,5.0,28.927142857142858,buena relación calidad precio con Sony PlayStation 5. 👍
Instagram,True,user_38333,CL,Apple,Apple Watch,2025-07-20 10:05:28.196741,3.812,54.0,duración increíble con Apple Apple Watch vale la pena. 🔥
Reddit,True,user_54294,CL,Samsung,Galaxy Watch,2025-07-20 13:46:11.196741,3.812,0.0,problemas constantes con Samsung Galaxy Watch busquen alternativas. 👎 #galaxywatch
TikTok,True,user_78766,CO,Sony,WF-1000XM4,2025-07-20 14:53:46.196741,3.812,10.0,calidad promedio con Sony WF-1000XM4. 🤔
Shopify,False,user_56346,MX,Adidas,NMD,2025-07-20 16:41:26.196741,1.0,28.927142857142858,demasiado caro para lo que ofrece con Adidas NMD pésima experiencia. 👎
Instagram,True,user_31245,PE,Sony,WH-1000XM5,2025-07-20 19:54:29.196741,3.812,25.0,problemas constantes con Sony WH-1000XM5. 😤
TikTok,True,user_80855,AR,Sony,Bravia TV,2025-07-20 22:29:12.196741,3.812,13.0,nada extraordinario con Sony Bravia TV sin más. 🆗
Amazon,False,user_23954,MX,Sony,WH-1000XM5,2025-07-21 00:03:33.196741,4.0,28.927142857142858,excelente calidad con Sony WH-1000XM5 súper recomendado. 😍
TikTok,True,user_16626,US,Samsung,Galaxy S24,2025-07-21 02:31:17.196741,3.812,21.0,demasiado caro para lo que ofrece con Samsung Galaxy S24 me arrepiento. ❌
Instagram,True,user_27143,CO,Apple,iPhone 15,2025-07-21 06:46:18.196741,3.812,52.0,soporte al cliente excelente con Apple iPhone 15 me encantó. ⭐
X/Twitter,True,user_89887,PE,Samsung,Galaxy Watch,2025-07-21 07:17:32.196741,3.812,3.0,está bien por el precio con Samsung Galaxy Watch sin más.  #recomendacion
Instagram,True,user_81141,PE,Adidas,Predator,2025-07-21 08:32:55.196741,3.812,59.0,vale cada peso con Adidas Predator lo volvería a comprar.
MercadoLibre,False,user_73837,CO,Apple,Apple Watch,2025-07-21 09:05:50.196741,5.0,28.927142857142858,experiencia fantástica con Apple Apple Watch vale la pena.  #apple
Reddit,True,user_95010,ES,Apple,AirPods Pro,2025-07-21 09:53:49.196741,3.812,0.0,no lo recomiendo con Apple AirPods Pro. 💔
Amazon,False,user_68066,US,Samsung,QLED TV,2025-07-21 12:41:02.196741,2.0,28.927142857142858,se dañó rápido con Samsung QLED TV pésima experiencia. ❌
MercadoLibre,False,user_79722,AR,Sony,Alpha Camera,2025-07-21 13:27:44.196741,4.0,28.927142857142858,vale cada peso con Sony Alpha Camera súper recomendado. ✨ #sony
X/Twitter,True,user_98452,CO,Nike,React Infinity,2025-07-21 13:47:00.196741,3.812,4.0,calidad promedio con Nike React Infinity sin más.  #nike
MercadoLibre,False,user_61932,CO,Apple,iPad Air,2025-07-21 14:16:13.196741,4.0,28.927142857142858,rendimiento excepcional con Apple iPad Air súper recomendado. ✨
Reddit,True,user_52030,CO,Adidas,Stan Smith,2025-07-21 14:25:06.196741,3.812,12.0,nada extraordinario con Adidas Stan Smith nada especial.  #tech
Instagram,True,user_52291,CO,Sony,WH-1000XM5,2025-07-21 16:05:24.196741,3.812,53.0,rendimiento excepcional con Sony WH-1000XM5 increíble producto. 😍 #wh-1000xm5
Amazon,False,user_70108,US,Samsung,Galaxy S24,2025-07-21 16:44:30.196741,5.0,28.927142857142858,experiencia fantástica con Samsung Galaxy S24 excelente compra. 👌 #review
MercadoLibre,False,user_38010,CL,Nike,Dri-FIT,2025-07-21 18:09:21.196741,2.0,28.927142857142858,ni muy bueno ni muy malo con Nike Dri-FIT. 🆗 #tech
Reddit,True,user_12049,MX,Sony,WH-1000XM5,2025-07-21 18:23:29.196741,3.812,19.0,pérdida de dinero con Sony WH-1000XM5 busquen alternativas. 😡 #tech
Instagram,True,user_43022,MX,Adidas,Predator,2025-07-21 21:09:10.196741,3.812,22.0,hace su trabajo con Adidas Predator veremos con el tiempo.
Instagram,True,user_67186,AR,Adidas,Stan Smith,2025-07-21 21:12:00.196741,3.812,9.0,problemas constantes con Adidas Stan Smith eviten comprarlo. ❌
TikTok,True,user_35614,CO,Sony,WF-1000XM4,2025-07-21 21:44:16.196741,3.812,13.0,impresionante tecnología con Sony WF-1000XM4. 🎉 #review
Reddit,True,user_62187,CL,Apple,iPhone 15,2025-07-22 01:16:45.196741,3.812,14.0,funciona correctamente con Apple iPhone 15 veremos con el tiempo. 😐
Instagram,True,user_87863,AR,Samsung,Galaxy Tab,2025-07-22 05:55:30.196741,3.812,13.0,sin problemas hasta ahora con Samsung Galaxy Tab.
Instagram,True,user_73036,ES,Nike,Air Jordan,2025-07-22 12:13:53.196741,3.812,43.0,problemas constantes con Nike Air Jordan me arrepiento. 😤
X/Twitter,True,user_58348,AR,Sony,Alpha Camera,2025-07-22 14:13:18.196741,3.812,0.0,cumple lo básico con Sony Alpha Camera.
X/Twitter,True,user_49936,CO,Adidas,Predator,2025-07-22 14:57:26.196741,3.812,13.0,fallas frecuentes con Adidas Predator no lo volvería a comprar. ❌
TikTok,True,user_92665,PE,Adidas,Stan Smith,2025-07-22 20:33:25.196741,3.812,38.0,rendimiento excepcional con Adidas Stan Smith vale la pena. ⭐
Reddit,True,user_64118,US,Apple,MacBook Pro,2025-07-22 20:52:45.196741,3.812,43.0,entrega rápida con Apple MacBook Pro súper recomendado. 👌 #review
Shopify,False,user_46194,AR,Samsung,Galaxy Buds,2025-07-23 00:02:23.196741,2.0,28.927142857142858,decepcionante compra con Samsung Galaxy Buds busquen alternativas. 😤 #compras
Instagram,True,user_45916,MX,Samsung,Galaxy Buds,2025-07-23 03:51:41.196741,3.812,7.0,veremos con el tiempo con Samsung Galaxy Buds nada especial. 😐
Reddit,True,user_45830,MX,Apple,iPad Air,2025-07-23 08:21:07.196741,3.812,0.0,lo esperado con Apple iPad Air cumple su función.  #apple
X/Twitter,True,user_40147,CO,Sony,Alpha Camera,2025-07-23 10:57:08.196741,3.812,49.0,lo mejor que he comprado con Sony Alpha Camera increíble producto. ✨
Amazon,False,user_91984,CL,Samsung,Galaxy Watch,2025-07-23 11:23:48.196741,3.0,28.927142857142858,producto estándar con Samsung Galaxy Watch sin más. 🤔
X/Twitter,True,user_63970,MX,Sony,Alpha Camera,2025-07-23 19:22:27.196741,3.812,62.0,superó mis expectativas con Sony Alpha Camera súper recomendado.
Reddit,True,user_63188,MX,Nike,Air Jordan,2025-07-23 23:53:29.196741,3.812,17.0,hace su trabajo con Nike Air Jordan nada especial.
Instagram,True,user_67941,DO,Apple,iPad Air,2025-07-24 02:13:00.196741,3.812,8.0,problemas constantes con Apple iPad Air busquen alternativas.
Amazon,False,user_80575,CO,Nike,Air Max 270,2025-07-24 02:35:13.196741,4.0,28.927142857142858,muy recomendado con Nike Air Max 270 me encantó.
Amazon,False,user_30958,PE,Nike,Air Force 1,2025-07-24 02:59:11.196741,5.0,28.927142857142858,excelente calidad con Nike Air Force 1 me encantó. 🔥
TikTok,True,user_33758,AR,Apple,iPad Air,2025-07-24 03:05:33.196741,3.812,12.0,soporte al cliente excelente con Apple iPad Air. 💯
X/Twitter,True,user_42759,AR,Sony,Alpha Camera,2025-07-24 07:38:57.196741,3.812,5.0,soporte al cliente excelente con Sony Alpha Camera excelente compra. 👍 #review
TikTok,True,user_15821,CO,Nike,Dri-FIT,2025-07-24 07:50:50.196741,3.812,33.0,funciona de maravilla con Nike Dri-FIT vale la pena.
TikTok,True,user_39902,US,Sony,Bravia TV,2025-07-24 10:54:05.196741,3.812,21.0,funciona correctamente con Sony Bravia TV veremos con el tiempo.
Instagram,True,user_65436,ES,Apple,iPad Air,2025-07-24 11:25:35.196741,3.812,10.0,demasiado caro para lo que ofrece con Apple iPad Air eviten comprarlo. 😞
Instagram,True,user_24031,CL,Samsung,Galaxy S24,2025-07-24 14:21:55.196741,3.812,85.0,excelente calidad con Samsung Galaxy S24 lo volvería a comprar.
