platform,is_social,user_id,country,brand,product,timestamp,rating,likes,text
TikTok,True,user_37097,DO,Apple,MacBook Pro,2025-05-01 06:31:08.196741,3.812,20.0,soporte al cliente excelente con Apple MacBook Pro lo volvería a comprar. 💯 #review
Instagram,True,user_78731,CL,Sony,WH-1000XM5,2025-05-01 08:32:28.196741,3.812,48.0,soporte al cliente excelente con Sony WH-1000XM5 súper recomendado. 🔥
Shopify,False,user_65069,PE,Apple,MacBook Pro,2025-05-01 10:08:04.196741,2.0,28.927142857142858,experiencia horrible con Apple MacBook Pro eviten comprarlo. 👎
Amazon,False,user_73998,DO,Apple,Apple Watch,2025-05-01 10:45:02.196741,5.0,28.927142857142858,experiencia fantástica con Apple Apple Watch me encantó. 👌 #apple
Instagram,True,user_70117,ES,Sony,PlayStation 5,2025-05-01 13:42:10.196741,3.812,7.0,producto estándar con Sony PlayStation 5 cumple su función. 😐 #tech
Amazon,False,user_63194,US,Nike,Air Jordan,2025-05-01 15:44:24.196741,3.0,28.927142857142858,producto estándar con Nike Air Jordan cumple su función.
MercadoLibre,False,user_94926,US,Samsung,Galaxy Buds,2025-05-01 17:26:41.196741,3.0,28.927142857142858,muy mala calidad con Samsung Galaxy Buds eviten comprarlo.  #samsung
Instagram,True,user_84692,PE,Sony,Alpha Camera,2025-05-01 17:52:01.196741,3.812,43.0,rendimiento excepcional con Sony Alpha Camera excelente compra.
TikTok,True,user_21542,US,Adidas,Ultraboost 22,2025-05-01 20:43:50.196741,3.812,44.0,muy recomendado con Adidas Ultraboost 22 increíble producto. 🎉
Amazon,False,user_93588,CL,Sony,PlayStation 5,2025-05-01 23:22:02.196741,2.0,28.927142857142858,cumple lo básico con Sony PlayStation 5 sin más. 🤔
Shopify,False,user_99959,ES,Sony,Bravia TV,2025-05-01 23:31:29.196741,4.0,28.927142857142858,muy recomendado con Sony Bravia TV vale la pena.
Instagram,True,user_20957,AR,Apple,MacBook Pro,2025-05-02 02:23:03.196741,3.812,57.0,superó mis expectativas con Apple MacBook Pro.
Shopify,False,user_97584,DO,Apple,iPhone 15,2025-05-02 05:20:45.196741,4.0,28.927142857142858,funciona correctamente con Apple iPhone 15 veremos con el tiempo. 🆗 #iphone15
Reddit,True,user_12313,CL,Nike,Air Max 270,2025-05-02 05:49:55.196741,3.812,21.0,superó mis expectativas con Nike Air Max 270 excelente compra. 💯
MercadoLibre,False,user_49257,CL,Samsung,QLED TV,2025-05-02 07:55:25.196741,5.0,28.927142857142858,duración increíble con Samsung QLED TV increíble producto. 👌
MercadoLibre,False,user_27512,PE,Adidas,NMD,2025-05-02 10:03:02.196741,2.0,28.927142857142858,demasiado caro para lo que ofrece con Adidas NMD. ❌
Shopify,False,user_11602,ES,Apple,Apple Watch,2025-05-02 14:29:58.196741,5.0,28.927142857142858,experiencia fantástica con Apple Apple Watch vale la pena.
TikTok,True,user_68978,DO,Nike,Air Jordan,2025-05-02 14:39:58.196741,3.812,55.0,experiencia fantástica con Nike Air Jordan me encantó. 🔥
Shopify,False,user_66093,CO,Nike,React Infinity,2025-05-02 20:19:59.196741,2.0,28.927142857142858,fallas frecuentes con Nike React Infinity busquen alternativas. 🤦‍♂️
Reddit,True,user_11383,DO,Sony,WH-1000XM5,2025-05-02 21:47:47.196741,3.812,12.0,nada extraordinario con Sony WH-1000XM5 nada especial.
TikTok,True,user_92058,CO,Samsung,Galaxy Watch,2025-05-03 01:59:13.196741,3.812,17.0,perfecto en todos los aspectos con Samsung Galaxy Watch súper recomendado. 👌
MercadoLibre,False,user_24855,CL,Nike,React Infinity,2025-05-03 05:50:24.196741,3.0,28.927142857142858,sin problemas hasta ahora con Nike React Infinity sin más. 👀 #recomendacion
MercadoLibre,False,user_43947,MX,Apple,Apple Watch,2025-05-03 13:57:57.196741,4.0,28.927142857142858,muy recomendado con Apple Apple Watch lo volvería a comprar.  #recomendacion
Instagram,True,user_42426,AR,Nike,React Infinity,2025-05-04 00:30:38.196741,3.812,27.0,nada extraordinario con Nike React Infinity sin más. 🆗
Shopify,False,user_22648,MX,Sony,PlayStation 5,2025-05-04 00:58:10.196741,2.0,28.927142857142858,entrega tardía con Sony PlayStation 5 no lo volvería a comprar.  #review
Reddit,True,user_99300,MX,Sony,PlayStation 5,2025-05-04 01:18:09.196741,3.812,12.0,experiencia fantástica con Sony PlayStation 5 increíble producto. ✨
Reddit,True,user_91515,DO,Sony,Bravia TV,2025-05-04 02:26:29.196741,3.812,16.0,excelente calidad con Sony Bravia TV súper recomendado. 😍
Reddit,True,user_66055,CL,Sony,Bravia TV,2025-05-04 11:54:04.196741,3.812,0.0,funciona correctamente con Sony Bravia TV.
Reddit,True,user_85233,ES,Samsung,QLED TV,2025-05-04 17:51:15.196741,3.812,22.0,pérdida de dinero con Samsung QLED TV eviten comprarlo. 😠 #recomendacion
X/Twitter,True,user_13689,DO,Sony,Alpha Camera,2025-05-04 19:09:40.196741,3.812,66.0,duración increíble con Sony Alpha Camera increíble producto. ⭐
MercadoLibre,False,user_87763,ES,Nike,Air Max 270,2025-05-04 22:34:24.196741,5.0,28.927142857142858,lo mejor que he comprado con Nike Air Max 270.
X/Twitter,True,user_42189,AR,Samsung,Galaxy Watch,2025-05-05 04:58:33.196741,3.812,0.0,lo esperado con Samsung Galaxy Watch cumple su función.
X/Twitter,True,user_90405,AR,Sony,WH-1000XM5,2025-05-05 07:20:13.196741,3.812,17.0,entrega tardía con Sony WH-1000XM5 me arrepiento. 😤
Amazon,False,user_10665,PE,Adidas,Stan Smith,2025-05-05 12:21:41.196741,3.0,28.927142857142858,muy mala calidad con Adidas Stan Smith busquen alternativas. 🤦‍♂️
TikTok,True,user_73747,DO,Nike,Dri-FIT,2025-05-05 15:44:07.196741,3.812,23.0,muy mala calidad con Nike Dri-FIT pésima experiencia.  #recomendacion
Amazon,False,user_42850,ES,Samsung,Galaxy Watch,2025-05-05 17:12:02.196741,3.0,28.927142857142858,hace su trabajo con Samsung Galaxy Watch nada especial. 🤔
Instagram,True,user_18812,CO,Nike,Air Max 270,2025-05-05 17:57:59.196741,3.812,22.0,duración pésima con Nike Air Max 270 me arrepiento. ❌
Instagram,True,user_28754,AR,Nike,Air Jordan,2025-05-05 18:00:01.196741,3.812,17.0,funciona correctamente con Nike Air Jordan veremos con el tiempo. 👀
X/Twitter,True,user_78327,US,Apple,Apple Watch,2025-05-05 19:28:16.196741,3.812,28.0,rendimiento excepcional con Apple Apple Watch increíble producto.
Amazon,False,user_26662,CL,Samsung,Galaxy Watch,2025-05-05 21:58:51.196741,4.0,28.927142857142858,nada extraordinario con Samsung Galaxy Watch veremos con el tiempo. 😐
X/Twitter,True,user_80702,DO,Apple,Apple Watch,2025-05-05 23:03:28.196741,3.812,0.0,duración pésima con Apple Apple Watch busquen alternativas. 😤 #tech
TikTok,True,user_73595,MX,Adidas,Stan Smith,2025-05-06 02:01:49.196741,3.812,69.0,buena relación calidad precio con Adidas Stan Smith lo volvería a comprar. 👍
Shopify,False,user_25799,CO,Nike,Dri-FIT,2025-05-06 09:22:52.196741,3.0,28.927142857142858,calidad promedio con Nike Dri-FIT cumple su función. 🤔 #compras
Reddit,True,user_33891,ES,Samsung,QLED TV,2025-05-06 09:24:24.196741,3.812,13.0,pérdida de dinero con Samsung QLED TV no lo volvería a comprar.  #samsung
TikTok,True,user_47272,ES,Adidas,Ultraboost 22,2025-05-06 09:29:17.196741,3.812,52.0,soporte al cliente terrible con Adidas Ultraboost 22 eviten comprarlo. 👎
Reddit,True,user_26366,CL,Samsung,Galaxy Tab,2025-05-06 11:42:13.196741,3.812,0.0,impresionante tecnología con Samsung Galaxy Tab me encantó. ⭐
Amazon,False,user_60338,MX,Sony,WH-1000XM5,2025-05-06 17:47:12.196741,1.0,28.927142857142858,decepcionante compra con Sony WH-1000XM5 busquen alternativas.
Instagram,True,user_67577,CL,Samsung,Galaxy S24,2025-05-06 18:36:08.196741,3.812,19.0,sin problemas hasta ahora con Samsung Galaxy S24 cumple su función. 👀
Amazon,False,user_11064,PE,Sony,PlayStation 5,2025-05-06 23:33:51.196741,3.0,28.927142857142858,veremos con el tiempo con Sony PlayStation 5 nada especial. 🤔
X/Twitter,True,user_45290,US,Apple,AirPods Pro,2025-05-07 03:50:16.196741,3.812,34.0,duración increíble con Apple AirPods Pro súper recomendado. 🎉
TikTok,True,user_71799,DO,Samsung,Galaxy Tab,2025-05-07 08:48:22.196741,3.812,58.0,experiencia horrible con Samsung Galaxy Tab no lo volvería a comprar. 😤 #recomendacion
TikTok,True,user_27625,US,Samsung,Galaxy Tab,2025-05-07 10:55:00.196741,3.812,21.0,demasiado caro para lo que ofrece con Samsung Galaxy Tab eviten comprarlo. 😞
Amazon,False,user_20242,ES,Nike,Air Max 270,2025-05-07 18:22:37.196741,3.0,28.927142857142858,veremos con el tiempo con Nike Air Max 270. 😐
X/Twitter,True,user_38183,US,Sony,WF-1000XM4,2025-05-07 20:07:32.196741,3.812,9.0,lo mejor que he comprado con Sony WF-1000XM4 me encantó. 💯
MercadoLibre,False,user_51111,DO,Adidas,Stan Smith,2025-05-07 20:43:43.196741,4.0,28.927142857142858,excelente calidad con Adidas Stan Smith vale la pena. 😍 #compras
X/Twitter,True,user_77314,ES,Samsung,Galaxy Buds,2025-05-07 22:28:39.196741,3.812,3.0,nada extraordinario con Samsung Galaxy Buds sin más.
Instagram,True,user_82260,ES,Adidas,NMD,2025-05-08 02:21:25.196741,3.812,23.0,decepcionante compra con Adidas NMD eviten comprarlo. 😡
Instagram,True,user_71599,ES,Apple,iPad Air,2025-05-08 10:38:43.196741,3.812,14.0,producto estándar con Apple iPad Air sin más. 🤔
Instagram,True,user_28910,MX,Samsung,Galaxy Tab,2025-05-08 14:22:39.196741,3.812,63.0,buena relación calidad precio con Samsung Galaxy Tab vale la pena. 👌 #compras
TikTok,True,user_78809,AR,Apple,Apple Watch,2025-05-08 15:15:57.196741,3.812,12.0,entrega tardía con Apple Apple Watch pésima experiencia. 😤
TikTok,True,user_78650,DO,Apple,Apple Watch,2025-05-08 21:01:03.196741,3.812,44.0,buena relación calidad precio con Apple Apple Watch me encantó. 🔥 #compras
Shopify,False,user_28264,AR,Sony,Alpha Camera,2025-05-08 21:56:23.196741,4.0,28.927142857142858,vale cada peso con Sony Alpha Camera vale la pena.  #alphacamera
Amazon,False,user_47110,US,Adidas,Stan Smith,2025-05-09 00:41:24.196741,5.0,28.927142857142858,duración increíble con Adidas Stan Smith. ✨
Reddit,True,user_56163,ES,Sony,WF-1000XM4,2025-05-09 02:40:53.196741,3.812,7.0,problemas constantes con Sony WF-1000XM4 no lo volvería a comprar.
Instagram,True,user_75960,CL,Apple,iPhone 15,2025-05-09 03:59:37.196741,3.812,0.0,mala inversión con Apple iPhone 15 no lo volvería a comprar. 😤
Shopify,False,user_60002,US,Samsung,QLED TV,2025-05-09 04:51:56.196741,4.0,28.927142857142858,superó mis expectativas con Samsung QLED TV. 👍
MercadoLibre,False,user_76952,AR,Samsung,QLED TV,2025-05-09 06:12:40.196741,3.0,28.927142857142858,superó mis expectativas con Samsung QLED TV vale la pena. ⭐
MercadoLibre,False,user_29690,AR,Samsung,Galaxy Tab,2025-05-09 07:48:45.196741,3.0,28.927142857142858,hace su trabajo con Samsung Galaxy Tab nada especial. 🆗
Amazon,False,user_79278,AR,Apple,MacBook Pro,2025-05-09 12:21:50.196741,5.0,28.927142857142858,funciona de maravilla con Apple MacBook Pro me encantó.  #tech
Shopify,False,user_93211,US,Nike,Air Force 1,2025-05-09 18:07:02.196741,5.0,28.927142857142858,entrega rápida con Nike Air Force 1 lo volvería a comprar. 👍
MercadoLibre,False,user_39573,PE,Adidas,Ultraboost 22,2025-05-09 19:28:22.196741,3.0,28.927142857142858,fallas frecuentes con Adidas Ultraboost 22 no lo volvería a comprar. 😤 #review
Amazon,False,user_79615,ES,Adidas,Superstar,2025-05-09 20:43:31.196741,5.0,28.927142857142858,rendimiento excepcional con Adidas Superstar increíble producto. ✨ #compras
Amazon,False,user_68781,DO,Samsung,Galaxy S24,2025-05-09 22:05:52.196741,2.0,28.927142857142858,defectuoso desde el inicio con Samsung Galaxy S24. 😠
MercadoLibre,False,user_23006,CO,Apple,iPad Air,2025-05-10 03:48:42.196741,4.0,28.927142857142858,veremos con el tiempo con Apple iPad Air veremos con el tiempo. 😐 #compras
Amazon,False,user_94188,AR,Adidas,NMD,2025-05-10 04:53:21.196741,2.0,28.927142857142858,lo esperado con Adidas NMD cumple su función. 🆗
Instagram,True,user_86765,CL,Samsung,Galaxy Watch,2025-05-10 05:18:23.196741,3.812,0.0,lo esperado con Samsung Galaxy Watch nada especial. 🤔
TikTok,True,user_18950,CL,Sony,WH-1000XM5,2025-05-10 08:17:44.196741,3.812,0.0,veremos con el tiempo con Sony WH-1000XM5 sin más.  #compras
TikTok,True,user_90903,CO,Sony,Alpha Camera,2025-05-10 09:11:18.196741,3.812,25.0,fallas frecuentes con Sony Alpha Camera eviten comprarlo.
Instagram,True,user_36100,ES,Samsung,Galaxy Buds,2025-05-10 13:15:12.196741,3.812,49.0,entrega rápida con Samsung Galaxy Buds excelente compra. 👌
MercadoLibre,False,user_60342,PE,Apple,MacBook Pro,2025-05-10 13:36:39.196741,2.0,28.927142857142858,muy mala calidad con Apple MacBook Pro pésima experiencia.  #tech
Instagram,True,user_24435,US,Samsung,Galaxy Buds,2025-05-10 14:25:47.196741,3.812,39.0,entrega rápida con Samsung Galaxy Buds increíble producto. 🎉 #galaxybuds
TikTok,True,user_87184,PE,Apple,MacBook Pro,2025-05-10 15:28:23.196741,3.812,10.0,funciona correctamente con Apple MacBook Pro nada especial.  #macbookpro
TikTok,True,user_48175,DO,Nike,Air Force 1,2025-05-10 20:03:15.196741,3.812,43.0,lo mejor que he comprado con Nike Air Force 1 lo volvería a comprar. 😍
TikTok,True,user_58526,US,Sony,Alpha Camera,2025-05-10 20:56:36.196741,3.812,28.0,fallas frecuentes con Sony Alpha Camera pésima experiencia. 😤
TikTok,True,user_12552,MX,Adidas,NMD,2025-05-11 01:34:47.196741,3.812,23.0,fallas frecuentes con Adidas NMD no lo volvería a comprar. 😞 #compras
Shopify,False,user_94030,ES,Samsung,Galaxy Tab,2025-05-11 01:58:31.196741,5.0,28.927142857142858,entrega rápida con Samsung Galaxy Tab me encantó.
X/Twitter,True,user_37720,DO,Nike,Air Jordan,2025-05-11 02:52:33.196741,3.812,19.0,no cumple expectativas con Nike Air Jordan pésima experiencia. 😡 #airjordan
Shopify,False,user_10863,CO,Nike,Dri-FIT,2025-05-11 07:12:01.196741,3.0,28.927142857142858,sin problemas hasta ahora con Nike Dri-FIT nada especial.
Shopify,False,user_20828,PE,Adidas,NMD,2025-05-11 09:30:34.196741,5.0,28.927142857142858,experiencia fantástica con Adidas NMD excelente compra. 🔥 #adidas
Reddit,True,user_13495,PE,Samsung,Galaxy Tab,2025-05-11 10:02:17.196741,3.812,6.0,rendimiento excepcional con Samsung Galaxy Tab súper recomendado. ⭐
TikTok,True,user_33125,CO,Samsung,Galaxy Watch,2025-05-11 10:13:40.196741,3.812,30.0,experiencia fantástica con Samsung Galaxy Watch lo volvería a comprar. 👌 #recomendacion
Reddit,True,user_13746,CL,Nike,Air Jordan,2025-05-11 10:15:29.196741,3.812,22.0,sin problemas hasta ahora con Nike Air Jordan nada especial.  #compras
X/Twitter,True,user_63120,PE,Apple,iPhone 15,2025-05-11 14:42:43.196741,3.812,57.0,diseño premium con Apple iPhone 15 lo volvería a comprar. 👍 #iphone15
X/Twitter,True,user_86962,PE,Adidas,Stan Smith,2025-05-11 18:54:01.196741,3.812,15.0,cumple lo básico con Adidas Stan Smith veremos con el tiempo.  #recomendacion
Reddit,True,user_18559,PE,Sony,Alpha Camera,2025-05-11 19:30:07.196741,3.812,24.0,no cumple expectativas con Sony Alpha Camera no lo volvería a comprar. 😞
X/Twitter,True,user_13455,PE,Nike,Air Force 1,2025-05-11 19:48:12.196741,3.812,4.0,tal como se describe con Nike Air Force 1 nada especial. 😐
Shopify,False,user_68856,ES,Samsung,Galaxy S24,2025-05-11 20:15:28.196741,2.0,28.927142857142858,decepcionante compra con Samsung Galaxy S24 no lo volvería a comprar. 😤 #recomendacion
X/Twitter,True,user_92578,CO,Nike,Air Max 270,2025-05-12 06:42:14.196741,3.812,0.0,demasiado caro para lo que ofrece con Nike Air Max 270.
MercadoLibre,False,user_60023,PE,Sony,Bravia TV,2025-05-12 09:35:53.196741,4.0,28.927142857142858,está bien por el precio con Sony Bravia TV.  #sony
X/Twitter,True,user_28139,ES,Apple,iPhone 15,2025-05-12 10:40:37.196741,3.812,44.0,impresionante tecnología con Apple iPhone 15 excelente compra. 👌 #tech
Reddit,True,user_97177,AR,Sony,Bravia TV,2025-05-12 11:55:03.196741,3.812,24.0,funciona de maravilla con Sony Bravia TV vale la pena.  #sony
Reddit,True,user_69168,PE,Nike,Air Max 270,2025-05-12 12:10:04.196741,3.812,23.0,hace su trabajo con Nike Air Max 270 veremos con el tiempo.
Instagram,True,user_74175,CL,Sony,WF-1000XM4,2025-05-12 12:39:39.196741,3.812,16.0,defectuoso desde el inicio con Sony WF-1000XM4 eviten comprarlo. 😞
X/Twitter,True,user_15504,CL,Nike,Air Jordan,2025-05-12 20:27:37.196741,3.812,0.0,nada extraordinario con Nike Air Jordan.  #recomendacion
Reddit,True,user_44754,DO,Adidas,Stan Smith,2025-05-12 21:42:53.196741,3.812,13.0,experiencia fantástica con Adidas Stan Smith increíble producto. 🎉 #tech
MercadoLibre,False,user_71148,PE,Sony,PlayStation 5,2025-05-12 22:26:54.196741,3.0,28.927142857142858,ni muy bueno ni muy malo con Sony PlayStation 5 nada especial.  #sony
MercadoLibre,False,user_55032,MX,Apple,iPhone 15,2025-05-12 22:39:22.196741,3.0,28.927142857142858,soporte al cliente terrible con Apple iPhone 15 me arrepiento. 😠 #recomendacion
Reddit,True,user_97173,PE,Sony,WH-1000XM5,2025-05-12 23:18:11.196741,3.812,5.0,excelente calidad con Sony WH-1000XM5 increíble producto. ⭐
MercadoLibre,False,user_40753,AR,Apple,MacBook Pro,2025-05-13 01:48:12.196741,2.0,28.927142857142858,pérdida de dinero con Apple MacBook Pro no lo volvería a comprar. 💔 #apple
Instagram,True,user_35106,AR,Apple,iPad Air,2025-05-13 05:46:48.196741,3.812,65.0,perfecto en todos los aspectos con Apple iPad Air.
X/Twitter,True,user_85255,CL,Apple,iPhone 15,2025-05-13 07:29:30.196741,3.812,60.0,muy recomendado con Apple iPhone 15.
Shopify,False,user_89389,AR,Nike,Air Jordan,2025-05-13 07:29:52.196741,3.0,28.927142857142858,funciona correctamente con Nike Air Jordan nada especial. 🤔 #airjordan
TikTok,True,user_17123,MX,Nike,Air Force 1,2025-05-13 08:24:46.196741,3.812,61.0,vale cada peso con Nike Air Force 1.
X/Twitter,True,user_98908,ES,Sony,WF-1000XM4,2025-05-13 10:18:27.196741,3.812,51.0,soporte al cliente excelente con Sony WF-1000XM4 increíble producto.  #sony
Instagram,True,user_95037,ES,Adidas,Ultraboost 22,2025-05-13 13:27:26.196741,3.812,35.0,superó mis expectativas con Adidas Ultraboost 22 me encantó. 👍
X/Twitter,True,user_71564,DO,Nike,React Infinity,2025-05-13 13:55:00.196741,3.812,48.0,soporte al cliente terrible con Nike React Infinity me arrepiento.
Instagram,True,user_39706,US,Sony,Bravia TV,2025-05-13 15:04:17.196741,3.812,18.0,no cumple expectativas con Sony Bravia TV pésima experiencia. 💔
X/Twitter,True,user_74122,CO,Apple,iPhone 15,2025-05-13 16:59:40.196741,3.812,71.0,experiencia fantástica con Apple iPhone 15 vale la pena.  #tech
X/Twitter,True,user_92207,AR,Nike,Air Force 1,2025-05-13 18:12:11.196741,3.812,81.0,excelente calidad con Nike Air Force 1 súper recomendado.  #compras
Shopify,False,user_79541,DO,Samsung,QLED TV,2025-05-13 19:58:56.196741,3.0,28.927142857142858,producto estándar con Samsung QLED TV sin más. 👀 #qledtv
X/Twitter,True,user_19684,PE,Sony,PlayStation 5,2025-05-13 22:26:06.196741,3.812,28.0,lo mejor que he comprado con Sony PlayStation 5 excelente compra.
Shopify,False,user_72847,CO,Nike,Air Max 270,2025-05-14 01:09:26.196741,5.0,28.927142857142858,muy recomendado con Nike Air Max 270 me encantó. 👍 #review
TikTok,True,user_45645,CO,Sony,Alpha Camera,2025-05-14 02:54:26.196741,3.812,48.0,entrega rápida con Sony Alpha Camera increíble producto. 🔥
Instagram,True,user_12348,DO,Sony,WF-1000XM4,2025-05-14 11:20:53.196741,3.812,12.0,está bien por el precio con Sony WF-1000XM4 nada especial. 👀
MercadoLibre,False,user_53540,PE,Apple,MacBook Pro,2025-05-14 11:43:18.196741,4.0,28.927142857142858,ni muy bueno ni muy malo con Apple MacBook Pro nada especial. 👀 #tech
TikTok,True,user_84381,DO,Apple,iPad Air,2025-05-14 13:57:37.196741,3.812,0.0,duración increíble con Apple iPad Air súper recomendado.
Amazon,False,user_35496,CL,Sony,WH-1000XM5,2025-05-14 15:52:48.196741,1.0,28.927142857142858,experiencia horrible con Sony WH-1000XM5 pésima experiencia. 👎 #compras
Amazon,False,user_52147,CO,Samsung,Galaxy Tab,2025-05-14 16:06:01.196741,4.0,28.927142857142858,soporte al cliente excelente con Samsung Galaxy Tab excelente compra. 😍 #galaxytab
Shopify,False,user_44520,ES,Adidas,Superstar,2025-05-14 22:41:12.196741,4.0,28.927142857142858,lo esperado con Adidas Superstar cumple su función.  #recomendacion
X/Twitter,True,user_45112,US,Apple,iPad Air,2025-05-14 22:41:57.196741,3.812,13.0,cumple lo básico con Apple iPad Air sin más.  #recomendacion
TikTok,True,user_78506,MX,Apple,Apple Watch,2025-05-14 22:48:13.196741,3.812,53.0,soporte al cliente excelente con Apple Apple Watch lo volvería a comprar. 🎉
Instagram,True,user_20252,AR,Samsung,Galaxy Watch,2025-05-14 22:58:57.196741,3.812,47.0,no lo recomiendo con Samsung Galaxy Watch eviten comprarlo. 😡 #recomendacion
Reddit,True,user_28607,DO,Samsung,Galaxy S24,2025-05-14 23:20:09.196741,3.812,32.0,pérdida de dinero con Samsung Galaxy S24 busquen alternativas. 🤦‍♂️
MercadoLibre,False,user_79045,ES,Nike,Air Max 270,2025-05-14 23:37:09.196741,3.0,28.927142857142858,cumple lo básico con Nike Air Max 270 cumple su función. 😐
Reddit,True,user_26429,CO,Samsung,Galaxy Watch,2025-05-15 00:50:05.196741,3.812,49.0,muy recomendado con Samsung Galaxy Watch lo volvería a comprar. 🎉
X/Twitter,True,user_77760,ES,Sony,WF-1000XM4,2025-05-15 04:37:53.196741,3.812,9.0,hace su trabajo con Sony WF-1000XM4.
Instagram,True,user_22712,DO,Adidas,Superstar,2025-05-15 08:38:41.196741,3.812,30.0,superó mis expectativas con Adidas Superstar. 😍
Reddit,True,user_68079,PE,Apple,iPhone 15,2025-05-15 10:15:23.196741,3.812,11.0,sin problemas hasta ahora con Apple iPhone 15 nada especial.  #compras
Instagram,True,user_58704,CL,Apple,Apple Watch,2025-05-15 10:38:18.196741,3.812,33.0,demasiado caro para lo que ofrece con Apple Apple Watch eviten comprarlo. 😤
MercadoLibre,False,user_95175,MX,Nike,Air Force 1,2025-05-15 13:27:54.196741,4.0,28.927142857142858,soporte al cliente excelente con Nike Air Force 1. 💯 #recomendacion
MercadoLibre,False,user_78839,ES,Nike,Air Force 1,2025-05-15 14:17:42.196741,4.0,28.927142857142858,excelente calidad con Nike Air Force 1 súper recomendado. ⭐ #nike
Instagram,True,user_99610,CL,Nike,Dri-FIT,2025-05-15 18:41:37.196741,3.812,35.0,problemas constantes con Nike Dri-FIT me arrepiento. 😠
Shopify,False,user_29340,DO,Samsung,Galaxy Buds,2025-05-15 20:43:17.196741,5.0,28.927142857142858,funciona de maravilla con Samsung Galaxy Buds excelente compra. 🔥 #galaxybuds
Shopify,False,user_16725,PE,Samsung,Galaxy Watch,2025-05-16 03:00:16.196741,5.0,28.927142857142858,lo mejor que he comprado con Samsung Galaxy Watch me encantó. 👌
X/Twitter,True,user_22838,PE,Samsung,Galaxy Buds,2025-05-16 04:22:02.196741,3.812,23.0,entrega tardía con Samsung Galaxy Buds. 😡
Shopify,False,user_14224,CL,Samsung,Galaxy Buds,2025-05-16 06:02:07.196741,4.0,28.927142857142858,vale cada peso con Samsung Galaxy Buds vale la pena. ✨
Reddit,True,user_36287,CO,Sony,WH-1000XM5,2025-05-16 06:57:26.196741,3.812,23.0,rendimiento excepcional con Sony WH-1000XM5 increíble producto. ⭐
Amazon,False,user_63558,MX,Sony,PlayStation 5,2025-05-16 10:07:39.196741,5.0,28.927142857142858,experiencia fantástica con Sony PlayStation 5. 😍
Instagram,True,user_24435,CO,Apple,Apple Watch,2025-05-16 10:48:15.196741,3.812,31.0,buena relación calidad precio con Apple Apple Watch. ⭐
TikTok,True,user_60860,CL,Samsung,Galaxy Buds,2025-05-16 15:48:57.196741,3.812,27.0,funciona correctamente con Samsung Galaxy Buds.
TikTok,True,user_19710,DO,Apple,Apple Watch,2025-05-16 16:36:42.196741,3.812,15.0,perfecto en todos los aspectos con Apple Apple Watch me encantó.  #applewatch
Reddit,True,user_59668,MX,Sony,Alpha Camera,2025-05-16 21:43:33.196741,3.812,36.0,mala inversión con Sony Alpha Camera.  #alphacamera
X/Twitter,True,user_58435,DO,Adidas,Ultraboost 22,2025-05-17 01:15:09.196741,3.812,22.0,ni muy bueno ni muy malo con Adidas Ultraboost 22 veremos con el tiempo. 🆗
MercadoLibre,False,user_54875,AR,Nike,Air Max 270,2025-05-17 02:02:45.196741,4.0,28.927142857142858,duración increíble con Nike Air Max 270 lo volvería a comprar. 🎉 #compras
TikTok,True,user_30582,MX,Sony,Bravia TV,2025-05-17 05:07:43.196741,3.812,69.0,soporte al cliente excelente con Sony Bravia TV lo volvería a comprar. 👌 #braviatv
Shopify,False,user_34697,ES,Nike,React Infinity,2025-05-17 05:34:17.196741,2.0,28.927142857142858,fallas frecuentes con Nike React Infinity. 😡 #tech
TikTok,True,user_69270,CO,Samsung,Galaxy S24,2025-05-17 05:40:41.196741,3.812,74.0,muy recomendado con Samsung Galaxy S24. 🔥 #galaxys24
X/Twitter,True,user_34586,US,Nike,Dri-FIT,2025-05-17 08:17:12.196741,3.812,27.0,sin problemas hasta ahora con Nike Dri-FIT.  #compras
Reddit,True,user_41804,US,Samsung,QLED TV,2025-05-17 11:30:16.196741,3.812,66.0,rendimiento excepcional con Samsung QLED TV me encantó.  #recomendacion
X/Twitter,True,user_46007,US,Nike,Dri-FIT,2025-05-17 14:57:24.196741,3.812,53.0,vale cada peso con Nike Dri-FIT súper recomendado. 💯
X/Twitter,True,user_89840,AR,Nike,Air Jordan,2025-05-17 15:07:19.196741,3.812,21.0,tal como se describe con Nike Air Jordan. 👀
Reddit,True,user_20682,ES,Adidas,Stan Smith,2025-05-17 18:33:21.196741,3.812,41.0,demasiado caro para lo que ofrece con Adidas Stan Smith busquen alternativas.
MercadoLibre,False,user_63674,DO,Samsung,Galaxy Buds,2025-05-17 18:59:54.196741,2.0,28.927142857142858,problemas constantes con Samsung Galaxy Buds.
Reddit,True,user_11854,ES,Sony,WH-1000XM5,2025-05-17 19:44:04.196741,3.812,40.0,excelente calidad con Sony WH-1000XM5 me encantó.
Amazon,False,user_50112,CO,Sony,WF-1000XM4,2025-05-17 22:01:41.196741,4.0,28.927142857142858,funciona de maravilla con Sony WF-1000XM4. 😍
X/Twitter,True,user_19403,DO,Samsung,Galaxy Watch,2025-05-18 00:56:57.196741,3.812,24.0,impresionante tecnología con Samsung Galaxy Watch lo volvería a comprar. 👌
Instagram,True,user_57409,DO,Samsung,Galaxy S24,2025-05-18 01:52:14.196741,3.812,30.0,vale cada peso con Samsung Galaxy S24 me encantó. 👍
TikTok,True,user_94029,MX,Sony,Bravia TV,2025-05-18 02:09:11.196741,3.812,23.0,experiencia horrible con Sony Bravia TV. 💔 #sony
