platform,is_social,user_id,country,brand,product,timestamp,rating,likes,text
Instagram,True,user_80184,AR,Adidas,Predator,2025-06-05 03:42:48.196741,3.812,0.0,duración pésima con Adidas Predator. 😤
Instagram,True,user_72368,DO,Adidas,Predator,2025-06-05 05:04:09.196741,3.812,62.0,impresionante tecnología con Adidas Predator súper recomendado.
Reddit,True,user_68188,MX,Nike,React Infinity,2025-06-05 05:55:17.196741,3.812,14.0,lo esperado con Nike React Infinity cumple su función.
Instagram,True,user_44774,US,Nike,Air Force 1,2025-06-05 08:00:18.196741,3.812,0.0,soporte al cliente terrible con Nike Air Force 1 me arrepiento.
Instagram,True,user_80004,MX,Sony,PlayStation 5,2025-06-05 12:01:55.196741,3.812,59.0,soporte al cliente excelente con Sony PlayStation 5 increíble producto. ✨ #compras
Reddit,True,user_59689,US,Samsung,Galaxy S24,2025-06-05 12:05:09.196741,3.812,53.0,duración increíble con Samsung Galaxy S24 increíble producto. ⭐
MercadoLibre,False,user_34151,AR,Samsung,Galaxy S24,2025-06-05 12:33:13.196741,4.0,28.927142857142858,superó mis expectativas con Samsung Galaxy S24 lo volvería a comprar. ✨
MercadoLibre,False,user_54473,MX,Apple,Apple Watch,2025-06-05 13:04:11.196741,4.0,28.927142857142858,entrega rápida con Apple Apple Watch vale la pena.  #applewatch
Reddit,True,user_51910,MX,Samsung,QLED TV,2025-06-05 15:18:14.196741,3.812,65.0,rendimiento excepcional con Samsung QLED TV excelente compra. 🎉
MercadoLibre,False,user_74237,CO,Sony,WF-1000XM4,2025-06-05 18:47:11.196741,4.0,28.927142857142858,rendimiento excepcional con Sony WF-1000XM4 me encantó. ⭐
MercadoLibre,False,user_86725,AR,Samsung,Galaxy Tab,2025-06-05 20:14:04.196741,5.0,28.927142857142858,rendimiento excepcional con Samsung Galaxy Tab excelente compra. 🎉
X/Twitter,True,user_26265,CL,Sony,Bravia TV,2025-06-05 23:30:06.196741,3.812,61.0,duración increíble con Sony Bravia TV vale la pena.  #sony
Shopify,False,user_47997,AR,Apple,MacBook Pro,2025-06-06 01:22:52.196741,5.0,28.927142857142858,duración increíble con Apple MacBook Pro increíble producto. ✨
MercadoLibre,False,user_54993,MX,Adidas,Predator,2025-06-06 01:48:47.196741,3.0,28.927142857142858,diseño premium con Adidas Predator increíble producto.
Reddit,True,user_99245,CO,Apple,MacBook Pro,2025-06-06 04:05:24.196741,3.812,33.0,pérdida de dinero con Apple MacBook Pro pésima experiencia. 😠 #tech
X/Twitter,True,user_14845,US,Samsung,Galaxy Buds,2025-06-06 04:53:48.196741,3.812,0.0,lo mejor que he comprado con Samsung Galaxy Buds excelente compra. 🔥
TikTok,True,user_34613,US,Sony,WF-1000XM4,2025-06-06 06:57:01.196741,3.812,69.0,excelente calidad con Sony WF-1000XM4.  #sony
Shopify,False,user_78136,MX,Adidas,Ultraboost 22,2025-06-06 08:56:44.196741,3.0,28.927142857142858,producto estándar con Adidas Ultraboost 22 sin más.
TikTok,True,user_13966,MX,Sony,Bravia TV,2025-06-06 10:26:52.196741,3.812,0.0,producto estándar con Sony Bravia TV cumple su función.
MercadoLibre,False,user_89171,ES,Sony,WH-1000XM5,2025-06-06 10:38:41.196741,2.0,28.927142857142858,problemas constantes con Sony WH-1000XM5 pésima experiencia.  #review
TikTok,True,user_77649,DO,Apple,iPad Air,2025-06-06 12:58:43.196741,3.812,30.0,diseño premium con Apple iPad Air me encantó. 🎉
Shopify,False,user_62286,MX,Samsung,Galaxy Watch,2025-06-06 19:36:57.196741,4.0,28.927142857142858,entrega rápida con Samsung Galaxy Watch vale la pena. 🔥
X/Twitter,True,user_89826,DO,Samsung,Galaxy Buds,2025-06-06 21:26:19.196741,3.812,0.0,fallas frecuentes con Samsung Galaxy Buds eviten comprarlo. 😡
Amazon,False,user_60723,MX,Samsung,Galaxy Tab,2025-06-06 21:46:47.196741,5.0,28.927142857142858,buena relación calidad precio con Samsung Galaxy Tab súper recomendado. 👌
Instagram,True,user_94913,US,Sony,PlayStation 5,2025-06-06 23:28:09.196741,3.812,23.0,ni muy bueno ni muy malo con Sony PlayStation 5.
TikTok,True,user_73335,MX,Sony,WH-1000XM5,2025-06-06 23:41:58.196741,3.812,67.0,experiencia fantástica con Sony WH-1000XM5 excelente compra. ⭐ #tech
MercadoLibre,False,user_29126,DO,Adidas,Stan Smith,2025-06-07 03:00:37.196741,5.0,28.927142857142858,impresionante tecnología con Adidas Stan Smith excelente compra.
Instagram,True,user_78390,AR,Apple,MacBook Pro,2025-06-07 08:33:26.196741,3.812,63.0,impresionante tecnología con Apple MacBook Pro excelente compra. ⭐
MercadoLibre,False,user_55746,DO,Samsung,Galaxy S24,2025-06-08 09:46:21.196741,5.0,28.927142857142858,excelente calidad con Samsung Galaxy S24 excelente compra.
X/Twitter,True,user_72094,DO,Samsung,Galaxy Watch,2025-06-08 11:18:27.196741,3.812,3.0,defectuoso desde el inicio con Samsung Galaxy Watch. 😡
Amazon,False,user_19334,CL,Adidas,Predator,2025-06-08 11:52:11.196741,3.0,28.927142857142858,se dañó rápido con Adidas Predator busquen alternativas. 💔
Shopify,False,user_86756,DO,Adidas,Ultraboost 22,2025-06-08 17:53:34.196741,3.0,28.927142857142858,tal como se describe con Adidas Ultraboost 22 sin más.  #tech
MercadoLibre,False,user_43666,MX,Apple,MacBook Pro,2025-06-08 18:20:50.196741,3.0,28.927142857142858,funciona correctamente con Apple MacBook Pro veremos con el tiempo. 😐
X/Twitter,True,user_93385,US,Nike,Air Max 270,2025-06-08 22:59:08.196741,3.812,47.0,demasiado caro para lo que ofrece con Nike Air Max 270 busquen alternativas. 😤
Amazon,False,user_17752,US,Adidas,Ultraboost 22,2025-06-08 23:40:13.196741,4.0,28.927142857142858,excelente calidad con Adidas Ultraboost 22.  #recomendacion
Reddit,True,user_32670,CO,Nike,Air Jordan,2025-06-09 04:38:29.196741,3.812,12.0,ni muy bueno ni muy malo con Nike Air Jordan cumple su función.  #compras
TikTok,True,user_13667,ES,Sony,Alpha Camera,2025-06-09 08:01:27.196741,3.812,63.0,experiencia fantástica con Sony Alpha Camera. 🎉
MercadoLibre,False,user_14797,CO,Nike,Air Force 1,2025-06-09 12:44:40.196741,5.0,28.927142857142858,entrega rápida con Nike Air Force 1 increíble producto. 👌 #airforce1
MercadoLibre,False,user_88346,CL,Sony,PlayStation 5,2025-06-09 16:32:59.196741,5.0,28.927142857142858,perfecto en todos los aspectos con Sony PlayStation 5 vale la pena. 🔥 #recomendacion
TikTok,True,user_77256,US,Sony,WF-1000XM4,2025-06-09 18:09:34.196741,3.812,31.0,impresionante tecnología con Sony WF-1000XM4 increíble producto.  #recomendacion
Shopify,False,user_96798,DO,Adidas,Ultraboost 22,2025-06-09 19:32:39.196741,3.0,28.927142857142858,hace su trabajo con Adidas Ultraboost 22 nada especial. 👀
Amazon,False,user_26877,MX,Samsung,QLED TV,2025-06-10 02:40:08.196741,3.0,28.927142857142858,problemas constantes con Samsung QLED TV busquen alternativas.
X/Twitter,True,user_90540,US,Nike,Air Jordan,2025-06-10 03:15:13.196741,3.812,62.0,lo mejor que he comprado con Nike Air Jordan me encantó. 👍
Amazon,False,user_42271,DO,Nike,Air Max 270,2025-06-10 06:04:41.196741,2.0,28.927142857142858,funciona correctamente con Nike Air Max 270 nada especial.  #tech
Amazon,False,user_54089,PE,Nike,Air Force 1,2025-06-10 07:12:17.196741,5.0,28.927142857142858,soporte al cliente excelente con Nike Air Force 1 me encantó. 🎉
TikTok,True,user_92742,PE,Samsung,Galaxy Buds,2025-06-10 09:29:34.196741,3.812,0.0,no lo recomiendo con Samsung Galaxy Buds no lo volvería a comprar. 💔
Amazon,False,user_65150,US,Adidas,Superstar,2025-06-10 10:40:44.196741,4.0,28.927142857142858,diseño premium con Adidas Superstar.
Shopify,False,user_37477,MX,Apple,MacBook Pro,2025-06-10 12:00:29.196741,2.0,28.927142857142858,pérdida de dinero con Apple MacBook Pro pésima experiencia.
Amazon,False,user_78490,MX,Apple,iPhone 15,2025-06-10 12:11:22.196741,5.0,28.927142857142858,soporte al cliente excelente con Apple iPhone 15 súper recomendado.
Reddit,True,user_70853,DO,Nike,React Infinity,2025-06-10 12:35:23.196741,3.812,60.0,funciona de maravilla con Nike React Infinity increíble producto. 👍 #tech
Reddit,True,user_94485,ES,Apple,iPhone 15,2025-06-10 16:38:57.196741,3.812,2.0,problemas constantes con Apple iPhone 15 no lo volvería a comprar. 💔
Reddit,True,user_46408,ES,Samsung,Galaxy S24,2025-06-10 18:08:11.196741,3.812,36.0,cumple lo básico con Samsung Galaxy S24.  #samsung
MercadoLibre,False,user_49677,US,Samsung,Galaxy Tab,2025-06-10 21:22:48.196741,3.0,28.927142857142858,veremos con el tiempo con Samsung Galaxy Tab sin más. 👀
Instagram,True,user_67619,PE,Apple,iPhone 15,2025-06-10 22:43:38.196741,3.812,4.0,está bien por el precio con Apple iPhone 15 sin más.  #tech
Reddit,True,user_73627,US,Nike,Air Jordan,2025-06-10 22:55:28.196741,3.812,10.0,diseño premium con Nike Air Jordan increíble producto. ⭐ #airjordan
X/Twitter,True,user_50380,DO,Samsung,QLED TV,2025-06-11 00:26:57.196741,3.812,36.0,vale cada peso con Samsung QLED TV vale la pena. 💯
MercadoLibre,False,user_37102,US,Samsung,Galaxy S24,2025-06-11 02:33:49.196741,4.0,28.927142857142858,impresionante tecnología con Samsung Galaxy S24. 👌 #tech
X/Twitter,True,user_11526,ES,Adidas,Predator,2025-06-11 06:09:33.196741,3.812,10.0,sin problemas hasta ahora con Adidas Predator veremos con el tiempo.  #recomendacion
Reddit,True,user_45117,CO,Samsung,Galaxy S24,2025-06-11 07:31:36.196741,3.812,11.0,problemas constantes con Samsung Galaxy S24. 😡
TikTok,True,user_82459,MX,Samsung,Galaxy Tab,2025-06-11 12:16:26.196741,3.812,10.0,no lo recomiendo con Samsung Galaxy Tab eviten comprarlo. 💔
Shopify,False,user_99523,US,Sony,Alpha Camera,2025-06-11 13:32:56.196741,4.0,28.927142857142858,entrega rápida con Sony Alpha Camera vale la pena. 😍
X/Twitter,True,user_39521,US,Nike,Air Max 270,2025-06-11 16:17:57.196741,3.812,18.0,veremos con el tiempo con Nike Air Max 270 sin más. 👀
MercadoLibre,False,user_65878,PE,Samsung,Galaxy Buds,2025-06-11 16:18:55.196741,5.0,28.927142857142858,muy recomendado con Samsung Galaxy Buds. 👌
MercadoLibre,False,user_43545,AR,Samsung,Galaxy Watch,2025-06-11 16:24:03.196741,3.0,28.927142857142858,cumple lo básico con Samsung Galaxy Watch cumple su función.
X/Twitter,True,user_72781,PE,Nike,Air Max 270,2025-06-11 17:57:20.196741,3.812,0.0,tal como se describe con Nike Air Max 270 cumple su función.  #nike
MercadoLibre,False,user_45300,DO,Nike,Dri-FIT,2025-06-11 22:35:14.196741,4.0,28.927142857142858,excelente calidad con Nike Dri-FIT excelente compra.
X/Twitter,True,user_99664,ES,Nike,React Infinity,2025-06-12 00:55:33.196741,3.812,30.0,perfecto en todos los aspectos con Nike React Infinity increíble producto. 💯 #reactinfinity
MercadoLibre,False,user_95461,ES,Nike,Dri-FIT,2025-06-12 02:44:10.196741,4.0,28.927142857142858,excelente calidad con Nike Dri-FIT excelente compra. 🔥
Instagram,True,user_72580,US,Apple,MacBook Pro,2025-06-12 08:26:02.196741,3.812,60.0,muy mala calidad con Apple MacBook Pro me arrepiento. 😞 #review
Instagram,True,user_49932,DO,Nike,Air Max 270,2025-06-12 13:09:43.196741,3.812,12.0,duración pésima con Nike Air Max 270 me arrepiento.
Shopify,False,user_58551,CL,Nike,Air Jordan,2025-06-12 14:50:34.196741,3.0,28.927142857142858,cumple lo básico con Nike Air Jordan cumple su función. 😐
Instagram,True,user_29769,CO,Adidas,Ultraboost 22,2025-06-12 16:17:42.196741,3.812,8.0,funciona de maravilla con Adidas Ultraboost 22. 💯
X/Twitter,True,user_21830,DO,Samsung,Galaxy Tab,2025-06-12 18:01:07.196741,3.812,61.0,entrega rápida con Samsung Galaxy Tab excelente compra. 👍
Reddit,True,user_34819,CL,Samsung,Galaxy S24,2025-06-12 18:07:42.196741,3.812,11.0,sin problemas hasta ahora con Samsung Galaxy S24 sin más.
X/Twitter,True,user_54308,PE,Sony,PlayStation 5,2025-06-12 20:47:12.196741,3.812,49.0,duración increíble con Sony PlayStation 5 súper recomendado. 👍 #tech
Reddit,True,user_90611,MX,Apple,Apple Watch,2025-06-12 21:17:58.196741,3.812,14.0,buena relación calidad precio con Apple Apple Watch lo volvería a comprar. 🔥
Shopify,False,user_28837,DO,Adidas,NMD,2025-06-13 03:54:29.196741,4.0,28.927142857142858,buena relación calidad precio con Adidas NMD increíble producto. ⭐
MercadoLibre,False,user_54909,AR,Adidas,NMD,2025-06-13 05:17:54.196741,2.0,28.927142857142858,pérdida de dinero con Adidas NMD pésima experiencia. 🤦‍♂️ #review
Shopify,False,user_99320,ES,Samsung,Galaxy Watch,2025-06-13 08:11:55.196741,4.0,28.927142857142858,nada extraordinario con Samsung Galaxy Watch cumple su función.
Reddit,True,user_76074,PE,Adidas,Predator,2025-06-13 08:17:07.196741,3.812,33.0,experiencia fantástica con Adidas Predator me encantó. 💯
Amazon,False,user_93563,AR,Apple,iPad Air,2025-06-13 10:40:19.196741,2.0,28.927142857142858,se dañó rápido con Apple iPad Air busquen alternativas. 😤
X/Twitter,True,user_79932,US,Adidas,Superstar,2025-06-13 11:59:42.196741,3.812,38.0,excelente calidad con Adidas Superstar increíble producto. 👌
Instagram,True,user_30387,US,Apple,iPhone 15,2025-06-13 12:27:03.196741,3.812,8.0,hace su trabajo con Apple iPhone 15. 👀
Amazon,False,user_28057,MX,Nike,Dri-FIT,2025-06-13 12:46:19.196741,4.0,28.927142857142858,impresionante tecnología con Nike Dri-FIT me encantó.
X/Twitter,True,user_48722,PE,Apple,Apple Watch,2025-06-13 13:38:29.196741,3.812,20.0,no lo recomiendo con Apple Apple Watch busquen alternativas. 💔 #review
Instagram,True,user_60277,CO,Nike,Air Force 1,2025-06-13 15:06:08.196741,3.812,21.0,se dañó rápido con Nike Air Force 1. 😠 #recomendacion
Reddit,True,user_41604,MX,Sony,PlayStation 5,2025-06-13 19:00:09.196741,3.812,8.0,pérdida de dinero con Sony PlayStation 5 no lo volvería a comprar. ❌ #compras
Amazon,False,user_15850,CL,Sony,WH-1000XM5,2025-06-13 22:14:10.196741,5.0,28.927142857142858,superó mis expectativas con Sony WH-1000XM5 lo volvería a comprar.
Reddit,True,user_19094,ES,Adidas,Predator,2025-06-14 02:43:59.196741,3.812,17.0,experiencia fantástica con Adidas Predator súper recomendado. 👌
TikTok,True,user_87862,CL,Samsung,Galaxy Buds,2025-06-14 04:42:13.196741,3.812,76.0,vale cada peso con Samsung Galaxy Buds excelente compra. 👌
MercadoLibre,False,user_96252,ES,Apple,AirPods Pro,2025-06-14 15:22:06.196741,5.0,28.927142857142858,lo mejor que he comprado con Apple AirPods Pro lo volvería a comprar. 🔥 #recomendacion
Reddit,True,user_15693,PE,Adidas,Superstar,2025-06-14 17:40:03.196741,3.812,48.0,perfecto en todos los aspectos con Adidas Superstar increíble producto. 👌
TikTok,True,user_94394,CO,Samsung,Galaxy Tab,2025-06-14 19:14:05.196741,3.812,38.0,experiencia horrible con Samsung Galaxy Tab busquen alternativas.
TikTok,True,user_74651,AR,Apple,Apple Watch,2025-06-15 01:36:06.196741,3.812,68.0,funciona de maravilla con Apple Apple Watch lo volvería a comprar. 😍
MercadoLibre,False,user_61229,ES,Apple,iPad Air,2025-06-15 04:02:01.196741,5.0,28.927142857142858,perfecto en todos los aspectos con Apple iPad Air lo volvería a comprar. 👍 #recomendacion
Shopify,False,user_59034,AR,Adidas,Stan Smith,2025-06-15 06:25:18.196741,4.0,28.927142857142858,funciona de maravilla con Adidas Stan Smith me encantó. ✨
MercadoLibre,False,user_65392,US,Apple,MacBook Pro,2025-06-15 10:26:32.196741,5.0,28.927142857142858,entrega rápida con Apple MacBook Pro. ⭐ #apple
MercadoLibre,False,user_93859,DO,Sony,WF-1000XM4,2025-06-15 13:49:31.196741,4.0,28.927142857142858,soporte al cliente excelente con Sony WF-1000XM4 lo volvería a comprar. 💯
Reddit,True,user_74336,PE,Samsung,Galaxy S24,2025-06-15 19:55:09.196741,3.812,0.0,fallas frecuentes con Samsung Galaxy S24 busquen alternativas. 😞
TikTok,True,user_33363,ES,Apple,iPhone 15,2025-06-15 23:54:05.196741,3.812,42.0,calidad promedio con Apple iPhone 15 cumple su función. 🆗
Amazon,False,user_80390,PE,Samsung,Galaxy Tab,2025-06-16 08:02:04.196741,4.0,28.927142857142858,entrega rápida con Samsung Galaxy Tab lo volvería a comprar. 💯
Instagram,True,user_47397,CL,Apple,AirPods Pro,2025-06-16 09:07:23.196741,3.812,37.0,experiencia fantástica con Apple AirPods Pro vale la pena. ✨ #recomendacion
X/Twitter,True,user_94133,PE,Sony,Bravia TV,2025-06-16 09:15:13.196741,3.812,19.0,decepcionante compra con Sony Bravia TV pésima experiencia. 👎
Instagram,True,user_43330,CL,Samsung,Galaxy S24,2025-06-16 10:23:51.196741,3.812,27.0,no lo recomiendo con Samsung Galaxy S24 busquen alternativas. 🤦‍♂️
Amazon,False,user_26361,PE,Apple,Apple Watch,2025-06-16 17:01:01.196741,5.0,28.927142857142858,buena relación calidad precio con Apple Apple Watch excelente compra.
X/Twitter,True,user_85748,CO,Sony,Alpha Camera,2025-06-17 02:36:33.196741,3.812,55.0,diseño premium con Sony Alpha Camera increíble producto. 💯 #compras
MercadoLibre,False,user_44734,MX,Nike,Dri-FIT,2025-06-17 04:16:18.196741,4.0,28.927142857142858,funciona correctamente con Nike Dri-FIT nada especial. 🆗
Reddit,True,user_20417,CL,Samsung,Galaxy S24,2025-06-17 04:42:40.196741,3.812,39.0,vale cada peso con Samsung Galaxy S24 vale la pena.
X/Twitter,True,user_78951,DO,Adidas,NMD,2025-06-17 07:35:17.196741,3.812,83.0,diseño premium con Adidas NMD lo volvería a comprar. 👍
Amazon,False,user_65545,CL,Apple,AirPods Pro,2025-06-17 07:49:57.196741,3.0,28.927142857142858,veremos con el tiempo con Apple AirPods Pro nada especial. 🆗
MercadoLibre,False,user_42637,CO,Sony,PlayStation 5,2025-06-17 08:54:01.196741,5.0,28.927142857142858,excelente calidad con Sony PlayStation 5 me encantó.
Reddit,True,user_57139,CL,Sony,Alpha Camera,2025-06-17 09:14:18.196741,3.812,0.0,ni muy bueno ni muy malo con Sony Alpha Camera nada especial.
Shopify,False,user_12260,MX,Nike,Dri-FIT,2025-06-17 14:23:49.196741,5.0,28.927142857142858,soporte al cliente excelente con Nike Dri-FIT me encantó. 💯
TikTok,True,user_47200,CO,Samsung,Galaxy S24,2025-06-17 14:48:26.196741,3.812,51.0,superó mis expectativas con Samsung Galaxy S24.
Instagram,True,user_45989,AR,Sony,PlayStation 5,2025-06-17 18:37:41.196741,3.812,4.0,mala inversión con Sony PlayStation 5 eviten comprarlo. 😡
X/Twitter,True,user_22091,DO,Nike,Dri-FIT,2025-06-17 20:21:41.196741,3.812,0.0,nada extraordinario con Nike Dri-FIT veremos con el tiempo.
Amazon,False,user_78167,AR,Apple,Apple Watch,2025-06-17 20:44:37.196741,3.0,28.927142857142858,defectuoso desde el inicio con Apple Apple Watch eviten comprarlo. ❌
Instagram,True,user_16380,AR,Adidas,Stan Smith,2025-06-18 01:13:32.196741,3.812,86.0,excelente calidad con Adidas Stan Smith excelente compra. ✨
Instagram,True,user_36626,CO,Nike,Air Max 270,2025-06-18 03:16:10.196741,3.812,20.0,mala inversión con Nike Air Max 270 pésima experiencia. 😞
Reddit,True,user_89736,AR,Apple,MacBook Pro,2025-06-18 10:17:32.196741,3.812,16.0,pérdida de dinero con Apple MacBook Pro pésima experiencia.
Shopify,False,user_31465,AR,Adidas,Ultraboost 22,2025-06-18 11:33:28.196741,4.0,28.927142857142858,excelente calidad con Adidas Ultraboost 22 excelente compra. 😍
MercadoLibre,False,user_87251,ES,Nike,React Infinity,2025-06-18 12:01:48.196741,4.0,28.927142857142858,muy recomendado con Nike React Infinity increíble producto. 🔥
MercadoLibre,False,user_89220,CO,Nike,Air Jordan,2025-06-18 13:22:57.196741,5.0,28.927142857142858,entrega rápida con Nike Air Jordan me encantó.
X/Twitter,True,user_77277,AR,Sony,Alpha Camera,2025-06-18 17:19:05.196741,3.812,40.0,mala inversión con Sony Alpha Camera pésima experiencia.
TikTok,True,user_83695,ES,Adidas,Superstar,2025-06-18 18:31:38.196741,3.812,2.0,funciona correctamente con Adidas Superstar cumple su función.
Shopify,False,user_70142,CL,Samsung,Galaxy Buds,2025-06-18 19:38:30.196741,2.0,28.927142857142858,mala inversión con Samsung Galaxy Buds me arrepiento. 👎 #samsung
X/Twitter,True,user_21746,US,Nike,Air Max 270,2025-06-19 01:35:13.196741,3.812,19.0,calidad promedio con Nike Air Max 270 cumple su función.  #recomendacion
MercadoLibre,False,user_76692,DO,Apple,MacBook Pro,2025-06-19 03:00:15.196741,4.0,28.927142857142858,vale cada peso con Apple MacBook Pro súper recomendado. 👍 #review
Instagram,True,user_23878,US,Apple,MacBook Pro,2025-06-19 05:17:30.196741,3.812,11.0,excelente calidad con Apple MacBook Pro lo volvería a comprar. 🎉
Shopify,False,user_57069,CL,Apple,Apple Watch,2025-06-19 06:59:17.196741,4.0,28.927142857142858,diseño premium con Apple Apple Watch excelente compra. ⭐
Shopify,False,user_89223,PE,Nike,Dri-FIT,2025-06-19 10:02:27.196741,3.0,28.927142857142858,sin problemas hasta ahora con Nike Dri-FIT sin más.
MercadoLibre,False,user_79791,MX,Nike,Dri-FIT,2025-06-19 11:26:33.196741,5.0,28.927142857142858,perfecto en todos los aspectos con Nike Dri-FIT vale la pena.
X/Twitter,True,user_13454,CO,Samsung,Galaxy S24,2025-06-19 11:32:24.196741,3.812,26.0,funciona correctamente con Samsung Galaxy S24 sin más. 🤔
Amazon,False,user_96848,ES,Samsung,QLED TV,2025-06-19 11:33:53.196741,5.0,28.927142857142858,perfecto en todos los aspectos con Samsung QLED TV lo volvería a comprar. ✨
MercadoLibre,False,user_25663,US,Apple,Apple Watch,2025-06-19 12:13:00.196741,4.0,28.927142857142858,soporte al cliente excelente con Apple Apple Watch lo volvería a comprar.
Reddit,True,user_87101,PE,Apple,AirPods Pro,2025-06-19 13:50:11.196741,3.812,28.0,muy recomendado con Apple AirPods Pro me encantó. 👍
Reddit,True,user_10437,US,Samsung,Galaxy Tab,2025-06-19 17:29:42.196741,3.812,15.0,no cumple expectativas con Samsung Galaxy Tab busquen alternativas. 😠
Shopify,False,user_93379,DO,Samsung,QLED TV,2025-06-19 18:24:44.196741,3.0,28.927142857142858,hace su trabajo con Samsung QLED TV cumple su función. 🆗
Amazon,False,user_32954,PE,Sony,Bravia TV,2025-06-19 20:00:00.196741,4.0,28.927142857142858,impresionante tecnología con Sony Bravia TV lo volvería a comprar.
Shopify,False,user_40822,US,Adidas,Stan Smith,2025-06-20 01:29:30.196741,4.0,28.927142857142858,rendimiento excepcional con Adidas Stan Smith excelente compra. 👍
MercadoLibre,False,user_39431,DO,Adidas,Ultraboost 22,2025-06-20 05:09:21.196741,4.0,28.927142857142858,soporte al cliente excelente con Adidas Ultraboost 22 vale la pena.
X/Twitter,True,user_22208,CL,Sony,WF-1000XM4,2025-06-20 05:16:08.196741,3.812,20.0,ni muy bueno ni muy malo con Sony WF-1000XM4.
X/Twitter,True,user_67290,CO,Sony,PlayStation 5,2025-06-20 08:49:56.196741,3.812,37.0,duración pésima con Sony PlayStation 5 eviten comprarlo.
TikTok,True,user_55718,AR,Nike,React Infinity,2025-06-20 10:38:07.196741,3.812,22.0,experiencia fantástica con Nike React Infinity excelente compra.
Shopify,False,user_66595,AR,Adidas,NMD,2025-06-20 13:37:59.196741,4.0,28.927142857142858,buena relación calidad precio con Adidas NMD me encantó. ✨
MercadoLibre,False,user_27392,CO,Sony,WH-1000XM5,2025-06-20 13:57:52.196741,4.0,28.927142857142858,duración increíble con Sony WH-1000XM5 increíble producto. 💯
Amazon,False,user_95209,US,Apple,iPhone 15,2025-06-20 14:08:00.196741,2.0,28.927142857142858,nada extraordinario con Apple iPhone 15 veremos con el tiempo.  #iphone15
TikTok,True,user_20518,ES,Nike,Dri-FIT,2025-06-20 14:57:02.196741,3.812,11.0,producto estándar con Nike Dri-FIT veremos con el tiempo. 😐
Amazon,False,user_70029,DO,Samsung,Galaxy Watch,2025-06-20 21:58:17.196741,4.0,28.927142857142858,impresionante tecnología con Samsung Galaxy Watch me encantó.
Shopify,False,user_68891,DO,Nike,Air Force 1,2025-06-21 02:02:07.196741,5.0,28.927142857142858,excelente calidad con Nike Air Force 1 increíble producto. ⭐
Instagram,True,user_14212,CL,Apple,AirPods Pro,2025-06-21 02:45:32.196741,3.812,30.0,entrega tardía con Apple AirPods Pro busquen alternativas.
TikTok,True,user_45382,CO,Samsung,Galaxy Tab,2025-06-21 06:52:29.196741,3.812,27.0,cumple lo básico con Samsung Galaxy Tab. 👀
Instagram,True,user_70332,US,Nike,Air Jordan,2025-06-21 09:06:11.196741,3.812,44.0,perfecto en todos los aspectos con Nike Air Jordan súper recomendado. 💯 #airjordan
MercadoLibre,False,user_51888,ES,Adidas,Superstar,2025-06-21 11:35:18.196741,4.0,28.927142857142858,hace su trabajo con Adidas Superstar nada especial.  #recomendacion
MercadoLibre,False,user_38183,PE,Apple,iPad Air,2025-06-21 12:34:22.196741,4.0,28.927142857142858,entrega rápida con Apple iPad Air me encantó. 🎉
Amazon,False,user_14400,CL,Apple,iPhone 15,2025-06-21 13:02:50.196741,3.0,28.927142857142858,ni muy bueno ni muy malo con Apple iPhone 15 veremos con el tiempo. 🤔
Reddit,True,user_95679,US,Adidas,Ultraboost 22,2025-06-21 20:21:15.196741,3.812,18.0,cumple lo básico con Adidas Ultraboost 22 cumple su función. 😐
Instagram,True,user_93416,DO,Nike,Dri-FIT,2025-06-21 23:08:55.196741,3.812,32.0,nada extraordinario con Nike Dri-FIT sin más. 😐
Instagram,True,user_22160,MX,Sony,Alpha Camera,2025-06-22 01:19:56.196741,3.812,13.0,producto estándar con Sony Alpha Camera cumple su función. 👀 #sony
MercadoLibre,False,user_51573,PE,Samsung,Galaxy Tab,2025-06-22 09:33:43.196741,3.0,28.927142857142858,veremos con el tiempo con Samsung Galaxy Tab cumple su función. 😐
Instagram,True,user_19390,AR,Adidas,Stan Smith,2025-06-22 12:11:38.196741,3.812,34.0,duración pésima con Adidas Stan Smith eviten comprarlo.  #tech
TikTok,True,user_25715,ES,Samsung,QLED TV,2025-06-22 19:16:58.196741,3.812,42.0,funciona de maravilla con Samsung QLED TV increíble producto.
MercadoLibre,False,user_92076,AR,Nike,Air Force 1,2025-06-22 20:48:42.196741,4.0,28.927142857142858,impresionante tecnología con Nike Air Force 1 lo volvería a comprar.
Shopify,False,user_99224,CO,Nike,Air Jordan,2025-06-23 03:15:00.196741,5.0,28.927142857142858,lo mejor que he comprado con Nike Air Jordan súper recomendado. ✨ #review
Amazon,False,user_11413,CL,Apple,AirPods Pro,2025-06-23 10:39:34.196741,4.0,28.927142857142858,impresionante tecnología con Apple AirPods Pro excelente compra. 👌
X/Twitter,True,user_47629,PE,Apple,Apple Watch,2025-06-23 10:45:40.196741,3.812,56.0,funciona de maravilla con Apple Apple Watch lo volvería a comprar.
Reddit,True,user_72649,AR,Apple,iPad Air,2025-06-23 11:42:22.196741,3.812,11.0,sin problemas hasta ahora con Apple iPad Air. 🤔
